RT @TheLeoTerrell : Please listen to my Podcast: ""Your Vote is At Risk""  @ApplePodcasts @iTunes  https://t.co/ZfVvylWuhF https://t.co/HrNwScyzA2" RT @TheLeoTerrell : BIDEN BLUFFS: Members of black Delaware church dont recall Biden being ‘raised there https://t.co/BR0jn4wYaW RT @DariasNews1 : Interesting comments and perspective from Leo Terrell. Almost 100 percent of everyone I know in New Jersey is equally concerned. https://t.co/J0b4ToeuJD "RT @TheLeoTerrell : Sir, I am Black.  I am a Proud American. I love America. I am voting for @realDonaldTrump . @FoxNews  @seanhannity https://t.co/GIYV2hVgXP" RT @TheLeoTerrell : Looks like @BlackLivesMatter and #Antifa are #Lakers Fans. Where is the police Democratic Mayor? @MayorOfLA https://t.co/SuSijw0m8b RT @TheLeoTerrell : I kept my word @realDonaldTrump WATCH: Longtime Democrat Leo Terrell Keeps His Word &amp; Officially Casts His Vote For President Trump https://t.co/pHctUW20U4 RT @TheLeoTerrell : I am more qualified to become Vice-President than @SenKamalaHarris .  She has no morals and will sell her soul for power. #VoteTrump2020ToSaveAmerica @realDonaldTrump @seanhannity https://t.co/cAwvfMvEQQ RT @TheLeoTerrell : Drop this nonsense #Kayne and support @realDonaldTrump Stop playing head games and seeking attention. This election is real and plenty at stake. https://t.co/kgf7YsP1Sf RT @realDonaldTrump : Almost nobody showed up to the Sleepy Joe Biden Rally in Ohio. The reporting and polls are a Media Con Job - Fake News. We have far more support and enthusiasm than even in 2016. November 3rd. will be a great day for America!!!  #MAGA "RT @realDonaldTrump : So Biden is coughing and hacking and playing fingers with his mask, all over the place, and the Fake News doesnt want to even think about discussing it. Journalism has reached the all time low in history. Sadly, Lamestream knows this and doesnt even care!
RT @ACTBrigitte : I hear leftists saying they are worried about a peaceful transition of power if Trump loses...  This coming from the people who rioted in the streets and created fake Russia hoaxes and a phony impeachment because Hillary lost.  The hypocrisy is out of control, they're tone deaf!
RT @ACTBrigitte : Every time you hear a Biden commercial telling you all of his 'great' ideas, ask yourself...  Why didn't he do it during his 47 years of public service?
RT @ACTBrigitte : God Bless You, Mr. President!!  I will always stand for TRUTH and I will always stand with YOU! https://t.co/GEqCy4qT8d" Thank you! https://t.co/6MRdXZ74AQ "He must create a list, like I did! Always considered most important Presidential decision. Voters entitled to know!!!! https://t.co/yLaLTcOyPy
Mitt cant be thrilled about this! Joe also said yesterday hes running for the U.S. Senate (again) and totally forgot where he was (wrong State!). Joe has never been a nice or kind guy, so its easier to find this obvious &amp; rapidly getting worse dementia unacceptable for USA! https://t.co/QIpH7RDfAV
RT @marklevinshow : There Joe goes again https://t.co/w8bQGNcMbz" RT @GreggJarrett : Florida Man Caught Requesting Ballot For Wife Who Died In 2018 https://t.co/bFwNOM4Etm RT @GreggJarrett : World Health Organization Appeals To ‘All World Leaders: Stop Using Lockdown As Your Primary Control Method https://t.co/jAfgdeL8e1 "....Much of the money we have spent is on our ground game, said to be the best ever put together. Ill let you know how good it is on November 3rd. Very expensive to do, but opportunity could be BIG! I will spend additional money if we are not spending enough!
I keep reading Fake News stories that my campaign is running low on money. Not true, &amp; if it were so, I would put up money myself. The fact is that we have much more money than we had 4 years ago, where we spent much less money than Crooked Hillary, and still easily won, 306-223!
Great Florida Rally tonight. Big crowd, lot of enthusiasm (you win races with enthusiasm). Just got back. Tomorrow night its off to Pennsylvania and another BIG crowd. We are winning. Economy is starting to boom. Good timing!!!" WH Physician: Donald Trump Now Testing Negative for Coronavirus https://t.co/OR5PL893UO via @BreitbartNews https://t.co/TNBaLBfHwZ Charles Hurt: The Democrats Have Wanted to Destroy the Court for Decades https://t.co/C9KjZnYNg6 via @BreitbartNews VOTE TRUMP! "READ: Left-wing Radicals Post Online Guide to ‘Disrupting‘ the Country if Election is Close https://t.co/cBqmI2Fudi via @BreitbartNews. They know it is over for them. Law &amp; Order will prevail, strong version!
FLORIDA! Send in your absentee ballot if you have requested one. In-person Early Voting begins next week—so get your friends, get your family, get your neighbors, and GET OUT AND VOTE! Need more information? Go to https://t.co/gsFSgh2KPc! #MAGA https://t.co/WjjYSjZKKS
I did more in 47 months than Biden did in 47 years. Now, he is pushing the most far-left agenda ever put forward by a presidential nominee... https://t.co/ON0iRBfFS2
Biden refuses to answer questions on packing the Supreme Court. He says voters dont deserve to know. If they win, Dems will pack the #SCOTUS w/ radical left justices who will shred the #2A, empower violent mobs, and shield deadly criminals &amp; terrorists. https://t.co/alVSZUDc73
Joe Bidens agenda would be a catastrophe for Florida Seniors. For years, Biden tried to cut Social Security and Medicare. Now Biden is pledging mass amnesty and federal healthcare for illegal aliens—decimating Medicare and destroying Social Security...https://t.co/GgHP0NvpEe
It was great to be back in my home state of FLORIDA to make my official return to the campaign trail. I am energized by your prayers, humbled by your support, and absolutely determined to finish what we started and Make America Greater than Ever Before! https://t.co/XrQG0KPdUo" https://t.co/uMa2jU8inP "Getting ready to land in Florida. BIG CROWD! Live on various networks: @OANN, @cspan, @newsmax and others!!!
.@FoxNews allows more negative ads on me than practically all of the other networks combined. Not like the old days, but we will win even bigger than 2016. Roger Ailes was the GREATEST!
Im running as a proud Democrat, for the Senate. Sleepy Joe Biden today. Its only going to get worse. It is not sustainable for our County - China will own us!!!!
Biden losing big in Florida. Only Fake Polls show otherwise! Bad for Healthcare. Thinks hes running for the Senate. Forgot Mitt Romneys name, and where he was!" Happy National Farmers Day! https://t.co/2Q8dbu5UyO "The World Health Organization just admitted that I was right. Lockdowns are killing countries all over the world. The cure cannot be worse than the problem itself. Open up your states, Democrat governors. Open up New York. A long battle, but they finally did the right thing!" Republicans should be strongly focused on completing a wonderful stimulus package for the American People! "Whats going on, almost nobody is showing up for Sleepy Joe rallies!
Sleepy Joe Biden had a particularly bad day today. He couldnt remember the name of Mitt Romney, said again he was running for the U.S. Senate, and forgot what State he was in. If I did any of this, it would be disqualifying. With him, hes just Sleepy Joe!
He should sue the women, and all of those who illegally worked with them, for false and disgusting accusations!!! https://t.co/ocdEeIFxeF" Cuomo Dodges on Whether Sending COVID Patients into Nursing Homes Was a Mistake https://t.co/okkpcFyO3n via @BreitbartNews. He really blew it. Could have put people in Convention Center or Hospital Ship. Didnt have a clue!!! https://t.co/ZHDJevNtrd https://t.co/Elask8e0XS Leaving now for Florida Rally. Big crowds! "Viewership for NBA Finals Finale Crash Nearly 70%, Beaten by Random Sunday Night Football Game https://t.co/RaDVRSE4ww via @BreitbartNews Maybe they were watching in China, but I doubt it. Zero interest!
Joe Biden has let the Unions down — always has, always will! https://t.co/XIEd0dSEvA
307,000 Veterans Died waiting for Healthcare at the V.A. During Sleepy Joe Bidens Watch. 800,000 Records Stalled! A complete and total disaster." Heading to the Greatest Economy Of All Time!!!  VOTE "So Biden is coughing and hacking and playing fingers with his mask, all over the place, and the Fake News doesnt want to even think about discussing it. Journalism has reached the all time low in history. Sadly, Lamestream knows this and doesnt even care!" Almost nobody showed up to the Sleepy Joe Biden Rally in Ohio. The reporting and polls are a Media Con Job - Fake News. We have far more support and enthusiasm than even in 2016. November 3rd. will be a great day for America!!!  #MAGA "RT @WhiteHouse45 : President @realDonaldTrump's action on critical minerals builds on his commitment to reduce our reliance on foreign imports, bolster American industries, and strengthen our economy as we safely reopen from the pandemic.  https://t.co/79ZGLdbTui" RT @GOPChairwoman : .@realDonaldTrump delivers for all Americans! https://t.co/AwUaHDyDYS "RT @IvankaTrump : Under President Trumps leadership, Arizona is leading the Great American Comeback for the country. ????  Great being back in Phoenix today campaigning for ?@realDonaldTrump https://t.co/XPlmX9JRcI
RT @TeamTrump : Vice President @Mike_Pence: Where Joe Biden is talking about shutting down the economy, President @realDonaldTrump is opening up America again https://t.co/hBDBv36K3O
RT @TeamTrump : Vice President @Mike_Pence: Joe Biden has been a cheerleader for China, President @realDonaldTrump put China on notice on day one https://t.co/V8h2HBCbuv
RT @WhiteHouse45 : President @realDonaldTrump promised the American people he would nominate judges who will interpret the Constitution faithfully.   His nominee, Judge Amy Coney Barrett, fulfills that promise. https://t.co/eRaV7q2Hdc
RT @DiamondandSilk : Hey Georgia: Early Voting begins TODAY! Jim Crow Joe has had 47 years to provide solutions for our Country and has proved he has NONE. Cast your Early Vote for @realDonaldTrump TODAY.  Lets keep the Peach State RED! Find your Early Voting Location. https://t.co/wVpWClWRXT" HAPPY COLUMBUS DAY TO ALL! STOCK MARKET UP ANOTHER 300 POINTS - GREATEST LEADING INDICATOR OF THEM ALL!!! DONT RUIN IT WITH SLEEPY JOE!!! The Economy is about ready to go through the roof. Stock Market ready to break ALL-TIME RECORD. 401ks incredible. New Jobs Record. Remember all of this when you VOTE. Sleepy Joe wants to quadruple your Taxes. Depression!!! Dont let it happen! #MAGA Republicans must state loudly and clearly that WE are going to provide much better Healthcare at a much lower cost. Get the word out! Will always protect pre-existing conditions!!! https://t.co/599e8A6ogf "We will have Healthcare which is FAR BETTER than ObamaCare, at a FAR LOWER COST - BIG PREMIUM REDUCTION. PEOPLE WITH PRE EXISTING CONDITIONS WILL BE PROTECTED AT AN EVEN HIGHER LEVEL THAN NOW. HIGHLY UNPOPULAR AND UNFAIR INDIVIDUAL MANDATE ALREADY TERMINATED. YOURE WELCOME!
So Crazy to watch Senator Blumenthal of Connecticut lecture all on morals &amp; ethics when for 25 years he said he was a Great War Hero in Vietnam, and he was never even there. He lied &amp; cheated right up until the day he got caught. Thank you to those in military who turned him in!" STOCK MARKET UP BIG! "Remember, I wouldnt be President now had Obama and Biden properly done their job. The fact is, they were TERRIBLE!!!
RT @realDonaldTrump : Record 96% Approval Rating in the Republican Party. 53% Approval Rating Overall. Record 56% Better Off Now than 4 Years Ago (Gallup) during the Obama/Sleepy Joe Biden Administration, even as we round the turn on the China Plague. Thank you. Next year will be the BEST EVER!!!
RT @realDonaldTrump : See you in Sanford, Florida, tonight for a Big Rally. Covered Live on @OANN, @newsmax and @cspan. Enjoy!!!
RT @realDonaldTrump : Illinois has no place to go. Sad, isnt it? Vote Trump!" RT @realDonaldTrump : New York has gone to hell. Vote Trump! RT @realDonaldTrump : California is going to hell. Vote Trump! RT @realDonaldTrump : Save your 2nd Amendment. Vote Trump! https://t.co/3MU5xihohD RT @realDonaldTrump : SO MUCH FAKE NEWS! The Lamestream Media has gone absolutely insane because they realize we are winning BIG in all of the polls that matter. They write or show one false story after another. They are truly sick people. VOTE!!! "RT @realDonaldTrump : Remember, Stock Market at an All Time High, and going up. 401ks at RECORD. With Sleepy Joe comes Tax Increases, jobs losses and DEPRESSION like never seen before!!! VOTE!!!
November 3rd. will be the most exciting day in U.S. Election History, even more so than 2016. Tremendous excitement and enthusiasm, like perhaps never seen before. Nobody showing up to Sleepy Joe Rallies. Places are DEAD. Stiff!!! See you in Florida tonight." RT @Project_Veritas : We are 7-0 in lawsuits! @joerogan https://t.co/k7aiiQTYTd RT @newtgingrich : President Trump should replace the commissions cancelled second debate by accepting joe rogans offer and inviting Biden to join them.let Biden choose the topics and 20 foot social spacing. Give Biden no excuse to say no. "RT @BlackVoices4DJT : Were meeting voters exactly where they are! Today were in North Philly and were coming back tomorrow!  No Days Off! We are not taking any vote for granted!  #BlackVoicesForTrump #Outreach  ?? @BCFPresident https://t.co/fN8xzOfXJh" RT @CorrinRankin : Black voters speak out in Delaware. #blackvoicesfortrump ?? https://t.co/CkJ2skVn1z "RT @TheLeoTerrell : This is why you should listen to my new Podcast ""Your Vote is at Risk"" @ApplePodcasts @iTunes or click https://t.co/ZfVvylWuhF https://t.co/FYhoYIKRKR" RT @TheLeoTerrell : California is Trump Country.  @realDonaldTrump https://t.co/ZSfF2TnOVz RT @TheLeoTerrell : I suggest you restore funding for #LAPD and solve the homeless problem. Your tenure in office is almost over. Never again will you win public office in California. @MayorOfLA #VoteTrump2020ToSaveAmerica @realDonaldTrump https://t.co/wu6vH3J3nK RT @TheLeoTerrell : Michele Obama and @SenKamalaHarris : You called this peaceful protesting?  I do not think so. #VoteTrump2020 https://t.co/JcpsOnI9G0 "RT @kimKBaltimore : Thank you, WBFF FOX 45 for having me. I wish we had more time. The crime &amp; violence in Baltimore City is the direct result of poor leadership from my opponent to Baltimores City Council &amp; Mayor.  https://t.co/sDJbWLtWbr https://t.co/muQQEkiH76
RT @kimKBaltimore : Tens of millions of you have shared the struggle of black people in Baltimore. You cared about our black lives more than our own leaders.   They have done nothing for us. Now they cant hide.  We are the change.  Please support our movement: https://t.co/8yLL5VmMSU https://t.co/1sGyqXHpzt
RT @ErrolWebber : Today is October 12, 2020.   There are 22 days until President Trump is re-elected.  Liberals, what are you offended by today?
RT @ErrolWebber : If you're a Republican in California and you think your vote doesn't count, you are just listening to the propaganda they want you to hear.  Your vote matters. This year more than any other year.  We can flip this whole state. Help me do it! https://t.co/HRL9xRWGRx
RT @EricEarly_CA : @RealJamesWoods Thank you @RealJamesWoods   Schiff has been in Congress since 2001 and has accomplished nothing.   https://t.co/DYVr5SRLpN
RT @EricEarly_CA : Californians deserve better than Adam Schiff as their Congressman.  The American people deserve better than Adam Schiff as the Chair of the House Intelligence Committee.  We dont have to settle. We can vote this Schiff OUT! I need your support.
RT @EricEarly_CA : Are you nervous @AdamSchiff?   He hasnt run tv ads against a Republican opponent in 20 years.  Hes now running them against me.  Voters know you dont actually live in the district, you live 3,000 miles away in Maryland.   Im coming for you. https://t.co/JYeVNhUwlw" RT @EricEarly_CA : @65su @AdamSchiff Yep. Chip in to my campaign at this link if you want him out of office. https://t.co/U5TbA1jA1K "RT @OANN : Political outsider Eric Early is set to take the stage to debate lying, leaking Adam Schiff. Find out who has the best plan to clean up the crime, drugs &amp; homelessness plaguing the streets of Calif.'s 28th Congressional District.  Tune in to One America News for LIVE coverage! https://t.co/e9GoYehpt4" RT @Joy_Villa : EPIC! @EricEarly_CA for CONGRESS! https://t.co/BDC8BbM5lY "RT @EricEarly_CA : I run to:  • Remove national disgrace Adam Schiff from Congress;   • Deal with the problems facing Californias 28th District;   • Confront  the Communists, Socialists and Anarchists springing up around our great nation.   We can do this! https://t.co/0pWgePSirR
RT @EricEarly_CA : I helped organize a prayer group for the Los Angeles County deputies injured in an ambush shooting.   What did Adam Schiff do?  He continued his support of the radical defund the police movement!
RT @EricEarly_CA : My name is Eric Early.   Im running against Adam Schiff.   He doesnt care about improving our 28th District or America.   He runs a Hoax Factory and is obsessed with harming our President.   RT &amp; follow me to help me flush this Schiff out in November!" RT @EricEarly_CA : Eric Earlys New Commercial Shreds His Opponent Adam Schiff https://t.co/SHjoVGWfjT "Maxine Waters has long been considered the most corrupt person in Congress. Only habit keeps her there. Vote for Joe E. Collins lll and get this long time CROOK, Maxine Waters, out of office!!! https://t.co/NeJvqV8JXE
RT @joeecollins3 : Incredibly grateful that Fox showed my ad calling out Mansion Maxine Waters today.  Very cool! https://t.co/OkAJftqRwZ
RT @joeecollins3 : Do you know where I am? Maxine Waters $6 Million Mansion.  Do you know where Im NOT? Her District.  Mansion Maxine Waters doesnt live in her District — I do.  My name is Joe Collins and Im running for Congress against Maxine Waters.  Help Me WIN: https://t.co/K4OcfhUR0E https://t.co/GgnmvSWSq9
Stock Market Up Big. Do I get no credit for this? Never even mentioned by the Fake News. A New Record for Stocks and Jobs Growth. Remember, its the Economy Stupid.  VOTE!!!
Our Country cannot survive as a Socialist Nation, and thats what the Democrats want it to be. The USA will never become a large scale version of Venezuela. All control is already being taken away from Sleepy Joe. He has Zero to say!!!
The Republicans are giving the Democrats a great deal of time, which is not mandated, to make their self serving statements relative to our great new future Supreme Court Justice. Personally, I would pull back, approve, and go for STIMULUS for the people!!!" RT @realDonaldTrump : Its the only way they know! https://t.co/zVBuie6FTk "RT @MarshaBlackburn : Judge Amy Coney Barrett is a woman of character, a person of faith, and an exceptional mother of 7 children. https://t.co/IaCecgy23a" RT @ChuckGrassley : 2day the SCOTUS hearing for Judge Amy Coney Barrett begins at 8AM Iowa time/1st day of 4 days of hearing 2day judiciary members give 10 minute opening statements &amp; we will also hear from Judge Barrett for her opening statement Sen Ernst &amp; I both serve on the judiciary cmte "RT @MarshaBlackburn : Democrats are trying to fundamentally, structurally change the court so they can add liberal justices and use the judiciary as a superlegislature." RT @KatiePavlich : American Bar Association Awards Judge Barrett a 'Well-Qualified' Rating https://t.co/IfumBcUNMv "RT @SenTedCruz : Today is the 1st day of the confirmation hearing for Amy Coney Barrett, a respected judge who is supremely qualified to serve on #SCOTUS. Unfortunately, Democrats have been working to attack her integrity and smear her reputation. I am fearful we will see more of the same today. https://t.co/qVtKMltPWI" RT @HawleyMO : Judiciary Committee about to gavel in to begin hearings for #AmyConeyBarrett - I hope Democrats today will clearly renounce their attacks on her religious faith and admit these attacks have been wrong and bigoted RT @KatiePavlich : Love seeing Judge Barrett's kids in the front row. A big and diverse family! RT @ShannonBream : Judge Barrett has just arrived in the hearing room.  #SCOTUS https://t.co/W5Ji1Bg0w1 "Remember, Stock Market at an All Time High, and going up. 401ks at RECORD. With Sleepy Joe comes Tax Increases, jobs losses and DEPRESSION like never seen before!!! VOTE!!!" SO MUCH FAKE NEWS! The Lamestream Media has gone absolutely insane because they realize we are winning BIG in all of the polls that matter. They write or show one false story after another. They are truly sick people. VOTE!!! Save your 2nd Amendment. Vote Trump! https://t.co/3MU5xihohD "RT @ABC13News : President @realDonaldTrump claimed A Rigged Election on Twitter after learning about the mistake in Ohio's Franklin County that led to nearly 50,000 absentee ballots to be sent to the wrong voters.  https://t.co/jXeH9dIO1U https://t.co/XPadNIcVxQ
Illinois has no place to go. Sad, isnt it? Vote Trump!" New York has gone to hell. Vote Trump! California is going to hell. Vote Trump! He should have been prosecuted for the threats he made to the Justices. Pathetic! https://t.co/6eZbNboPTl "See you in Sanford, Florida, tonight for a Big Rally. Covered Live on @OANN, @newsmax and @cspan. Enjoy!!!
RT @glennbeck : .@GadSaad explains one major difference between President Trump and Joe Biden: Unlike Biden the ""political parasite"", Trump is full of energy. ""He's DONE a million things"". https://t.co/iEHElWH86n" Leading by a lot! https://t.co/U2Lz09W4Lr Rigged! https://t.co/nvUhewgT7q No. A Rigged Election! https://t.co/2Bizcisgco "The FBI and Law Enforcement must focus their energy on ANTIFA and the Radical Left, those who have spent the summer trying to burn down poorly run Democrat Cities throughout the USA!
Big spike in the China Plague in Europe and other places that the Fake News used to hold up as examples of places that are doing well, in order to make the U.S look bad. Be strong and vigilant, it will run its course. Vaccines and cures are coming fast!
These are Biden fools. ANTIFA RADICALS. Get them FBI, and get them now! https://t.co/RI9fH6sC1g
Taking advantage of fools. Law &amp; Order! Portland, call in the Feds! https://t.co/rJl9IVxdMM
Put these animals in jail, now. The Radical Left only knows how to take advantage of very dumb leadership fools. This is Biden! Law &amp; Order! https://t.co/w0yH3SqnrB" The Radical Left fools in Portland dont want any help from real Law Enforcement which we will provide instantaneously. Vote! https://t.co/WHvhZpyqAG "Record 96% Approval Rating in the Republican Party. 53% Approval Rating Overall. Record 56% Better Off Now than 4 Years Ago (Gallup) during the Obama/Sleepy Joe Biden Administration, even as we round the turn on the China Plague. Thank you. Next year will be the BEST EVER!!!" The Democrats are very proud! https://t.co/f3mzdYO4fF Its the only way they know! https://t.co/zVBuie6FTk "56% of registered voters tell Gallup that they are better off than they were 4 years ago (under Obama/Biden), while only 32% said they were worse off. Highest number on satisfaction yet recorded, by far. mgoodwin@nypost.com... And it will only get better!!! VOTE
Turn California around. No more shutdowns, rolling blackouts, forest fires (management), or water rationing (because millions of gallons are stupidly routed out into the Pacific Ocean). VOTE TRUMP! https://t.co/KSAgyPPmGc" See you in FLORIDA tomorrow night. Big Rally!!! "RT @LindseyGrahamSC : Honored to have the great @HerschelWalker join #TeamGraham! Herschel is a college and NFL great, an entrepreneur, and a terrific conservative. Thank you so much!" RT @AsteadWH : ppl may have other answers but they're wrong. this was firmly Trumps best tweet https://t.co/3AcmkWpgYi "The Fake News, @CNN, MSDNC, the failing @nytimes, and the rest, are working overtime spewing every lie in the book to make sure they can demean and disparage, at the highest level possible, to try and win an election for a man who is totally unqualified to be your President, S.J.
They are indeed Dr. Faucis own words. We have done a phenomenal job, according to certain governors. Many people agree...And now come the Vaccines &amp; Cures, long ahead of projections! https://t.co/ANqKL4eBqJ" https://t.co/3AnrRV7uSz https://t.co/gsFSghkmdM "Biden evades Court Packing question. @FoxNews  Because his puppet masters are willing to destroy the U.S. Supreme Court. Dont let this, and so many other really bad things, happen. VOTE!
People dont remember the chaos, hatred &amp; discord that we all went through during the 8 years of Obama/Biden. St. Louis, Oakland, Baltimore, and so many other places,  were a complete &amp; total disaster. I wouldnt be in the beautiful White House if it werent for Sleepy Joe, etc.
