Thank you Pennsylvania! With your vote, we will continue to support our Military, Veterans and our Police Officers. Biden and Harris would pass legislation to slash police funding all across America. They stand with the rioters – we stand with the HEROES of Law Enforcement! #MAGA https://t.co/qqTZPLqzFV
Thank you Montoursville, Pennsylvania! https://t.co/mvOazHnkoL" Thank you @albertmohler for your vote of confidence. You and I agree we can never compromise on Religious Liberty. #BeliversandBallots get to the polls and vote to protect Religious Liberty! https://t.co/MiucOF3KIs I LOVE TEXAS! https://t.co/EP7P3AvE8L "A vote for Biden and Harris is a vote to Ban Fracking, Ban Mining, and Completely Destroy Pennsylvania. A vote for me is a vote to remain ENERGY INDEPENDENT! Lets WIN PENNSYLVANIA, get out and VOTE! https://t.co/aR8iwO6Gvl
Over the next 4 years, we will make America into the Manufacturing Superpower of the World &amp; end our reliance on China. We will end surprise medical billing, require price transparency, lower drug prices even more, and we will always protect patients with pre-existing conditions! https://t.co/rXDakq3lp1
For the last 4 years you have seen me fight for you - and now I am relying on YOU to deliver another historic victory for our Country. A vote for me and the Republican Party is a vote for the American Dream! Get out and VOTE! #Election2020 #MAGA???? https://t.co/5EyXIHjfib
Thank you Butler, Pennsylvania! https://t.co/4bjYabvV6g
Just signed an order to protect fracking and the oil and gas industry. This means JOBS, low energy bills, and continued AMERICAN ENERGY INDEPENDENCE! Sleepy Joe would BAN fracking and destroy American energy jobs! He has NO clue!!
Thank you to the wonderful @RJHarrisWHP580 for the nice words on @FoxNews. Tremendous enthusiasm in Pennsylvania, and everywhere else. The Great Red Wave is coming!
We are ONE movement, ONE people, ONE family, and ONE GLORIOUS NATION UNDER GOD! Together with the incredible people of Pennsylvania, we will MAKE AMERICA GREAT AGAIN!   #ElectionDay #MAGA????  https://t.co/gsFSgh2KPc https://t.co/7EwfCm23U7
Over the next four years, we will stop the radical indoctrination of our students, and restore PATRIOTIC EDUCATION to our schools. We will teach our children to love our Country, honor our history, and always respect our great American Flag. https://t.co/gsFSgh2KPc https://t.co/RcQg0Vtk7V
We invested $2.5 TRILLION in the Military and we saved the Philly Shipyard. We passed VA Choice and VA Accountability. Al-Baghdadi and Soleimani are DEAD. I withdrew from the disastrous Iran Nuclear Deal—and instead of endless war, we are forging PEACE in the Middle East! https://t.co/Yz3ry24XHp" https://t.co/cb16JyPTPL https://t.co/pMV1Lker22 https://t.co/rlPJbzLvss https://t.co/vaf3BrSE6Q "3 days from now, we are going to win Pennsylvania! With your support, we will continue to bring back your jobs, and cut your taxes &amp; regulations. Biden would wipe out your factories, ship your jobs to China, raise your taxes, &amp; eliminate private healthcare!https://t.co/IjvKseSiTI
Thank you Reading, Pennsylvania! https://t.co/ywpNmRgxqz
Biden &amp; Obama owe a massive apology to the People of Flint. The water was poisoned on their watch. Not only did they fail them, Biden proudly accepted the endorsement of disastrous Gov Rick Snyder! Unlike Biden, I will always stand with the People of the Great State of MICHIGAN!" Bidens plan to Abolish American Energy is an economic DEATH SENTENCE for Pennsylvania. A vote for Biden is a vote to BAN FRACKING &amp; send PA into a nightmare of poverty &amp; depression. Gas prices would explode &amp; family incomes would plummet—I will always defend &amp; promote PA energy! https://t.co/tdYqMVWQGM "Our ECONOMY is now surging back faster, better, bigger and stronger than any nation on earth. We just had the best quarter of ECONOMIC GROWTH EVER recorded - a 33.1% increase, and next year will be the GREATEST ECONOMIC YEAR in the history of our Country! https://t.co/gsFSghkmdM https://t.co/Kbyl4zVUWM" I ran for office 4 years ago because I could not sit by &amp; watch any longer as a small group of Washington Insiders continued to get rich bleeding America Dry. No one embodies this betrayal &amp; treachery more than Joe Biden. Joe profited from the misery he unleashed on PA workers! https://t.co/2A9Ma5gCQX Pennsylvania is where the story of American Independence began – it is the state where the American Constitution was signed – and 3 days from now this is the state that will SAVE THE AMERICAN DREAM! A great RED WAVE is forming! https://t.co/gsFSghkmdM https://t.co/PussYXD40e "Thank you Newtown, Pennsylvania! #MAGA  https://t.co/0y7W5oRMom" Will be making a special speech in Pennsylvania at 12:30 P.M. Eastern! "Last night, our Countrys brave warriors rescued an American hostage in Nigeria. Our Nation salutes the courageous soldiers behind the daring nighttime rescue operation and celebrates the safe return of yet another American citizen!
Gallup: 56% of the U.S. is more satisfied with conditions now, even during a pandemic (we are rounding the turn!), than they were 4 years ago under Obama/Biden. Hasnt been equaled in recent times!" THANK YOU! #MAGA https://t.co/EEmSU6uPAy ".@Victoria_Spartz will be a terrific Congresswoman for Indiana. Working with me, she will Create Jobs, Lower Taxes, Deliver for our Farmers, and Protect and Defend your Second Amendment. Victoria has my Complete and Total Endorsement! #IN05 https://t.co/ka2L9jBKyq" We need Esther Joy King (@Esther4Congress) in Congress for Illinois! She is a Strong Supporter of our #MAGA agenda and shes running against a Total Fraud who the Democrats are now rushing to save. Esther has my Complete and Total Endorsement! #IL17 https://t.co/4A5uBGYmBf ".@JakeLaTurner will be a phenomenal Congressman for the people of Kansas! He will help us Lower your Taxes, Support our Brave Law Enforcement, Build the Wall, and Protect and Defend your Second Amendment. Jake has my Complete and Total Endorsement! #KS02 https://t.co/Nzpbh7DqUN
Steve Negron (@SteveNegronNH) will be a tireless advocate in Congress for the State of New Hampshire! An Air Force Veteran, he is Strong on the Economy, our Brave Law Enforcement and your Second Amendment. Steve has my Complete and Total Endorsement! #NH02 https://t.co/9Zq8LQXZkn
.@FrankPallottaNJ will be a great Congressman for the terrific people of New Jersey! He is Strong on the Economy &amp; Jobs, Low Taxes, the Military, our Brave Law Enforcement, and your Second Amendment. Frank has my Complete and Total Endorsement! #NJ05 https://t.co/ICVP3Nc6Cs
.@CheleFarley will be an incredible Congresswoman for the Great State of New York! An engineer and businesswoman, she is Strong on the Economy, Infrastructure, Law &amp; Order, and your Second Amendment. Chele has my Complete and Total Endorsement! #NY18 https://t.co/4NwXoQuozj
.@CliffBentz will be a great Congressman for the people of Oregon! A Successful Rancher, he is Strong on Jobs &amp; the Economy, Trade, Law &amp; Order, our Military &amp; Vets, and your Second Amendment. Cliff has my Complete and Total Endorsement! #OR02 https://t.co/8779E6IPzx
Sheriff Troy Nehls (@SheriffTNehls) will be an incredible Congressman for the State of Texas! An Army Veteran, he Strongly Supports Law &amp; Order, the Wall, our Military &amp; Vets, and your Second Amendment. Troy has my Complete and Total Endorsement! #TX22 https://t.co/yMWFwACCVL
We need Genevieve Collins (@GCForCongress) in Congress for Texas! She is Strong on Jobs &amp; the Economy, National Security and Education, and she will always Defend your Second Amendment. Genevieve has my Complete and Total Endorsement! #TX32 https://t.co/7YwS3ZwTQe
Big Jim Justice (@JimJusticeWV) is a GREAT Governor of West Virginia! An experienced businessman, he Creates Jobs, Stands with Life, Defends the Second Amendment, and Loves our Coal Miners. Big Jim has my Complete and Total Endorsement! #WVGOV https://t.co/Qrtvs1crqm
.@DerrickVanOrden will be a terrific Congressman for Wisconsin! A former Navy SEAL, he will stand for Law &amp; Order, Jobs, the Wall, and he will always Protect Life and the Second Amendment. Derrick has my Complete and Total Endorsement! #WI03 https://t.co/wFd72N7LI9
Blake Moore (@ElectBlakeMoore) will be a Great Congressman for Utah! He is Strong on Jobs &amp; the Economy, Healthcare, our Military &amp; Vets, and your Second Amendment. Blake has my Complete and Total Endorsement! #UT01 https://t.co/tj4Bx1rUuA
Dr. Mariannette Miller-Meeks (@MillerMeeks) will do a great job in Congress for Iowa! A Doctor and Veteran, she will Deliver Great Health Care, Defend Life, and Protect your Second Amendment. Mariannette has my Complete and Total Endorsement! #IA02
Scott Franklin (@ScottFranklinFL) will be an incredible Congressman for the State of Florida! A Navy Veteran, he will help us Lower your Taxes, Strengthen our Military and Defend your Second Amendment. Scott has my Complete and Total Endorsement! #FL15 https://t.co/RdZ1JPdJc6
Lisa McClain (@LisaForCongress) will be an incredible Congresswoman for Michigan! She is Strong on the Economy &amp; Jobs, Border Security, Infrastructure, our Military &amp; Vets, and the Second Amendment. Lisa has my Complete and Total Endorsement! #MI10 https://t.co/r2NokBwGfW
Congressman (@JDanBishop) is doing a terrific job for North Carolina! In Congress, Dan fights to Create Jobs, Strengthen our Military, and Defend your Second Amendment. Dan has my Complete and Total Endorsement! #NC09 https://t.co/hj7CYPcFFL
Vote for @NancyMace! Her opponent, Joe Cunningham, is a puppet for Nancy Pelosi and the Radical Left! #SC01 https://t.co/XCtZNrbrT6
Jim ONeill (@JimONeillNC) will be a fantastic Attorney General for North Carolina! Strong on Law &amp; Order, the Constitution, and the Second Amendment, Jim has my Complete and Total Endorsement!https://t.co/Oekn8B8l46
https://t.co/gsFSghkmdM #ElectionDay #MAGA???? https://t.co/j5F8vNZYPI" Big win for our very elite U.S. Special Forces today. Details to follow! Biden and the Radical Left are asking for the largest tax hike in the history of the U.S. Remember that when you VOTE! "Joe Biden will PACK THE COURT. Also, he never gave the answer who his Radical Left Justices will be!
I paid many millions of dollars in Taxes to the Federal Government, most of which was even paid early, or PREPAID. MANY $MILLIONS. The Failing @nytimes never likes reporting that!
President Obama meant a lot to Black people, but he didnt do a thing for Black people. Vernon Jones, Georgia State Represenative, Trump supporter. @ffweekend
Suburban Women are trending strongly to our campaign because they want SAFETY, SECURITY, and love the fact that I terminated the REGULATION that would destroy their neighborhood and with it, the American Dream. Biden would bring the REGULATION back in a MUCH stronger form!!!
A Biden win would mean the end of Fracking in Pennsylvania, Texas, and everywhere else. Millions of jobs would be lost, and Energy prices would soar. @OANN  And we would no longer be Energy Independent!!!" MAKE AMERICA GREAT AGAIN! https://t.co/BlvIw1qaYu https://t.co/jeGtpWi5mx "There is only one way to defend your dignity. There is only one way to defend your family and your Country. There is only one way to preserve, protect and defend the American Way of Life: you must show up and vote on November 3rd! https://t.co/gsFSgh2KPc https://t.co/14MbcBz2oH
Joe Biden is a corrupt politician who has done nothing but betray you for 47 long years - selling out to lobbyists, China, big pharma &amp; foreign countries. He will stab you in the back. He only cares about political power &amp; he will use that power to hurt you &amp; enrich his cronies! https://t.co/8B9kZ5sdEJ
...Bidens deadly migration policies will overwhelm taxpayers and open the floodgates to terrorists, jihadists, and violent extremists. Under my Administration, the safety of our families will always come FIRST!
Biden has pledged a staggering 700% increase in refugees from the most dangerous and violent terrorist hot spots on earth. He has also vowed to terminate our national security travel bans, allowing for unlimited migration from war zones, and terrorist havens..." https://t.co/aHEqP4fmIf https://t.co/B8m4mhNvct "Your far-left Dem Attorney General, and your Dem Governor tried to shut down our rally, silence the people of Minnesota, and take away your freedom of assembly. They thought we would cancel – but I said NO WAY, I will NEVER abandon the people of Minnesota! https://t.co/wF1uolGlf6
President Obama used to say that if you wanted to see something really screwed up, give it to Joe Biden to do. In fact, he tried to keep Joe from running, you dont have to do this Joe, and then wouldnt endorse him until long after the Primaries ended. Joe is lost!.
THANK YOU MINNESOTA! https://t.co/OMIAwVQcY7
Joe Biden will lock down our entire Country. Biden will make you a prisoner in your own home, and a prisoner in your own Country. Bidens plan will kill the American Dream—Get your friends, get your family, get your neighbors and GET OUT AND VOTE! #MAGA https://t.co/fH8Iq6i8d3
Ive done more in 47 months than Joe Biden has done in 47 years! A vote for Republicans is a vote for the American Dream, and the party of Abraham Lincoln! #MAGA https://t.co/gsFSgh2KPc
The Election should end on November 3rd., not weeks later!
This election is a choice between a Trump Super Boom or a Biden Depression, and its between a safe vaccine or a devastating Biden lockdown! https://t.co/FkOHz0XUS2 https://t.co/IEPULUXAXe
One of the most important issues is LAW &amp; ORDER. Biden stands with the rioters &amp; looters - I stand with the HEROES of law enforcement. If Biden wins, the rioters in the streets will be running your federal government. No city, no family, and no community will be safe. VOTE #MAGA! https://t.co/fjokM0yWiG" https://t.co/wl1codKkZ3 https://t.co/ewR0TUgCtX This election is the most important election of our lifetime! Get out and VOTE to #MAGA! https://t.co/jM4hTHUYDF "THANK YOU WISCONSIN! https://t.co/9l46T76kwu
Volunteer to be a Trump Election Poll Watcher. Sign up today!   #MAGA #Election2020  https://t.co/3AnrRUPTtZ
Your VOTE will continue HISTORIC job growth and make sure America keeps WINNING. Arizona, Georgia, Nevada, Texas - Get out and VOTE today! Find your Early Voting Location below. https://t.co/135RZzXIeI
We did not come this far, and fight this hard, only to surrender our Country back to the Washington Swamp—So get your friends, get your family, get your neighbors &amp; GET OUT &amp; VOTE! On November 3rd we must finish the job and Drain the Swamp once and for all.https://t.co/1HSPRkWMTg
Joe Biden is a corrupt politician—the Biden family is looking more &amp; more like a crime family. They took millions of $$ from the Chinese Communists, while Vice President Biden shipped Michigan jobs to China. If Biden wins, China Wins. When we win, Michigan wins, and AMERICA wins! https://t.co/YpnjH8838X
This election will decide whether we restore the rule of a corrupt political class – or whether we declare that in America, we are still governed by THE PEOPLE! Get out and VOTE! https://t.co/gsFSgh2KPc" Bidens speech is 90% made up stories and lies. Only broadcast on @FoxNews. "...Disasters. At every turn, Biden twisted his knife into the back of Michigan workers. In 2016, Michigan voted to FIRE this corrupt political establishment and you elected an outsider as President who is finally putting AMERICA FIRST!  #VOTE #MAGA" ...a cheerleader for NAFTA – sending your auto Jobs to Mexico. He voted for Chinas entry into the World Trade Organization – gutting your industries to finance Chinas rise. HALF of all Michigan auto manufacturing jobs were ELIMINATED after the Biden-Backed NAFTA and China... "Joe Biden spent the last 47 years outsourcing your jobs, opening your borders, and sacrificing American blood and treasure in endless foreign wars. He is a diehard globalist who cares nothing for working people. He repeatedly tried to cut Medicare &amp; Social Security. Biden was..." https://t.co/ucTqlNXNJ8 "Joe Biden has vowed to abolish the entire U.S. Energy Industry — no fracking, no energy, and high gas prices. While I am President, America will proudly remain ENERGY INDEPENDENT! https://t.co/pN1VF0zaB5" Biden wants the biggest Tax Increase in the history of our Country! https://t.co/BlMv2KsM7W THANK YOU MICHIGAN! https://t.co/eTip7kTQXJ "On my way to MICHIGAN, WISCONSIN, and MINNESOTA! https://t.co/7eEpmAJKCO
RT @TeamTrump : First Lady Melania Trump: We are a country of hope, not a country of fear or weakness. https://t.co/9n1841cdA6" RT @FLOTUS45 : Thank you @FtBraggNC for hosting another impressive visit to your base yesterday! @POTUS @realDonaldTrump and I are grateful to the men &amp; women of the United States military &amp; for the sacrifices they make in order to serve our country. May God bless our troops! https://t.co/EvAMiWDeoA "RT @GOP : We are a country of hope, not a country of fear or weakness. -@FLOTUS
RT @GOP : .@realDonaldTrump is committed to fighting for the Hispanic Community.   His policies help small businesses grow, household incomes increase, and home ownership expand.   Hispanics have achieved RECORD economic success because of Pres. Trump's thriving economic environment." RT @GOPChairwoman : The medias silence and lack of reporting about Bidens pay-for-play scheme with China is ridiculous. https://t.co/cX1ckoCdut Biden would lock us down forever. We are rounding the corner! https://t.co/zvSfKUo1gd "RT @GOP : Pres. Trump made progress in the Middle East where no POTUS could!  CNNs Oren Liebermann: The Israel &amp; Sudan deal is a significant…foreign policy accomplishment by the White House.  Washington Times' Charles Hurt: Pres. Trump reinvents the wheel w/ Middle East peace plans.
RT @GOP : But no one believes Biden will stand up to the Lefts power grab, given his unwillingness to condemn efforts to pack the Supreme Court and end the Senates filibuster. https://t.co/NvzPzaGkdk
RT @GOP : America is roaring back!   To continue progress like this, we NEED #FourMoreYears of @realDonaldTrump!   https://t.co/lQYB8jZfOp https://t.co/BHK0nNHhGr
RT @GOP : Only 4?? days until ELECTION DAY!   https://t.co/lQYB8jZfOp https://t.co/UnAKx6zXV6" Happy Birthday to our wonderful Ivanka. Now go back to work! November 3rd. https://t.co/mQF1xHV3Qh "RT @GOP : So when you consider your vote this year, remember this: in this election, people of faith have no greater champion than President Donald J. Trump. -@Mike_Pence https://t.co/5RKxFom2AI
Such a Great Honor! Thank you, Brett! https://t.co/AocgUSqOTU
RT @GOPChairwoman : We have put in place the largest ground game in history:  *3,000 staff  *2.5M+ volunteers  *160M+ door knocks &amp; phone calls  Our grassroots army is a huge difference maker, and it is fired up to re-elect @realDonaldTrump! https://t.co/s1N2oxrr4F
RT @GOP : When I promised to stand for the forgotten men and women of this country—whether they live in Chicago or Charlotte, Detroit or Dubuque, or if they are black or white—I meant it. And thats exactly what Ive done. -@realDonaldTrump https://t.co/tMGBrUWhR6" Great Red Wave! https://t.co/0HvMzsNwuZ https://t.co/qJUxmsEPv8 https://t.co/KhfjwtX2JT https://t.co/voxNnIYMpe This decision is CRAZY and so bad for our Country. Can you imagine what will happen during that nine day period. The Election should END on November 3rd. https://t.co/Hkftv9Jp56 "I would NEVER have taken the endorsement of the man who, through gross incompetence, poisoned the people of Flint, Michigan. Former RINO Governor Rick Snyder should be ashamed of himself and his service. I was asked to help fix it. Biden took his endorsement. VOTE TRUMP!!!" SECOND AMENDMENT! SUPREME COURT! "33.1% GDP - BEST IN USA HISTORY. IF I AM ELECTED, NEXT YEAR WILL BE OUR BEST EVER!" Rigged? https://t.co/KX5S0IrouV The @nytimes now admits that patients ill with Covid are getting better faster and at higher (much) percentages. More Testing equals more Cases. We have best testing. Deaths WAY DOWN. Hospitals have great additional capacity! Doing much better than Europe. Therapeutics working! "If Sleepy Joe Biden is actually elected President, the 4 Justices (plus1) that helped make such a ridiculous win possible would be relegated to sitting on not only a heavily PACKED COURT, but probably a REVOLVING COURT as well. At least the many new Justices will be Radical Left!" Biden will destroy the United States Supreme Court. Dont let this happen! #BidenCrimeFamiily MAKE AMERICA GREAT AGAIN. VOTE!!! Watch the Great Red Wave! Way ahead in Texas! Sports Reporter Calls Jack Nicklaus‘ Endorsement of President Trump ‘Divisive‘ https://t.co/BDcWAL6wp0 via @BreitbartNews Who is Darren Rovell? Thank you Jack!!! Pollak: 11 Shining Successes of President Donald Trump‘s First Term https://t.co/VW5w4YtBQ5 via @BreitbartNews Philadelphia Firefighters Union Votes to Endorse Trump https://t.co/rI6mQUZMbE via @BreitbartNews "Keith Ellison Restricts Freedom of Assembly of Political Opponents https://t.co/WAPPsfQrWk via @BreitbartNews We were planning for as many as 25,000 people in Minnesota. Now the Governor, at the last moment, will only allow the first 250 people to attend. Riots plus Omar = WIN!" https://t.co/OfmL1fPSjZ https://t.co/9m7w0uurXy "For years you had a President who apologized for America—now you have a President who is standing up for America! Get your friends, get your family, get your neighbors and GET OUT &amp; VOTE! On 11/3 we must finish the job and Drain the Swamp once and for all! https://t.co/RZzSuwLUSP" https://t.co/gsFSghkmdM https://t.co/fg5US7VpUJ "The Fake News refuses to cover the fact that GDP went up 33.1% for the 3rd Quarter, the best number by far in our Countrys history!
My Administration has suspended the entry of refugees from terror-compromised nations such as Syria, Somalia and Yemen. Bidens plan surges refugees 700% into Minnesota, Michigan &amp; Pennsylvania—burdening schools &amp; hospitals while opening the floodgates to Radical Islamic Terror.
Failed RINO former Governor Rick Snyder of Michigan was a disaster with respect to the Flint Water CATASTROPHE, and a very bad Governor overall. He hurt so many people with his gross incompetence. He reminds me of Sleepy Joe!
RT @LilTunechi : Just had a great meeting with @realdonaldtrump @potus besides what hes done so far with criminal reform, the platinum plan is going to give the community real ownership. He listened to what we had to say today and assured he will and can get it done. ???? https://t.co/Q9c5k1yMWf
Forced to move our Rally tonight in Fayetteville, North Carolina, to Monday, due to high speed winds and bad weather. I love you North Carolina. Stay safe, see you on Monday!!!
If I dont sound like a typical Washington politician, its because Im NOT a politician. If I dont always play by the rules of the Washington Establishment, its because I was elected to fight for YOU, harder than anyone ever has before! https://t.co/gsFSgh2KPc https://t.co/kCtPkRWdY4
For half a century, Joe Biden has been outsourcing your jobs, opening your borders, and sacrificing American blood and treasure in endless foreign wars. Joe Biden is a corrupt politician—If Biden Wins, China Wins. When We Win, Florida Wins—and America Wins! https://t.co/UdqQqmxvL7
This election is a choice between the AMERICAN DREAM and a SOCIALIST NIGHTMARE. Our opponents want to turn America into Communist Cuba or Socialist Venezuela. As long as I am President, America will NEVER be a socialist Country! https://t.co/gsFSgh2KPc" https://t.co/OINMUQvdRo https://t.co/njpD3ekBOv "Your VOTE on Tuesday, November 3rd is going to SAVE OUR COUNTRY. We are going to defeat the Marxists, Socialists, Rioters, Flag-Burners, and Left-wing Extremists! Get out and VOTE! #MAGA https://t.co/gsFSgh2KPc" https://t.co/FUh5kox16R "I was thrilled to be back in my home state of FLORIDA! 5 days from now, we are going to win FLORIDA, and we are going to WIN 4 more years in the White House. Get out and VOTE! MAKE AMERICA GREAT AGAIN!!  https://t.co/cbk66G7tlU
THANK YOU TAMPA, FLORIDA! https://t.co/1gXlNJCdHl" Thank you to Joe Scarborough (@JoeNBC) for seeing the light. Our Country is doing great! https://t.co/7vLxNScOjo "A 3 day extension for Pennsylvania is a disaster for our Nation, and for Pennsylvania itself. The Democrats are trying to steal this Election. We have to get out and VOTE in even larger numbers. The Great Red Wave is coming!!!" Weekly Jobless Claims just hit a 7 month low! "....He also worked at, of all places, @Google. They all have big liability!!!
So it turns out that the wise guy promoted as Anonymous by the @nytimes, named Miles Taylor (who I never even heard of!), was only a little known staffer as opposed to a Senior Administration Official. He then scammed @CNN, lied to @andersoncooper, &amp; got a job there....
Our hearts are with the people of France. America stands with our oldest Ally in this fight. These Radical Islamic terrorist attacks must stop immediately. No country, France or otherwise can long put up with it!
RT @ByronYork : Important to note that Miles Taylor was not DHS chief of staff on September 5, 2018, when he published 'Anonymous' op-ed in NYT. He was a DHS policy adviser, which NYT characterized as a 'senior official in the Trump administration.'" Thank you Mark! #MAGA https://t.co/ptqzlqb8ep THANK YOU! #MAGA https://t.co/24HVNRnBSX "GDP number just announced. Biggest and Best in the History of our Country, and not even close. Next year will be FANTASTIC!!! However, Sleepy Joe Biden and his proposed record setting tax increase, would kill it all. So glad this great GDP number came out before November 3rd.
