Statement by Donald J. Trump, The President of the United States  Full Video:https://t.co/EHqzsLbbJG https://t.co/Eu4IsLNsKD" RT @OANN : #TODAY: President Trump's legal team is set to hold a hearing in Mich. on election integrity. @OANN will provide full coverage starting at 6 p.m. EST / 3 p.m PST! #OANN "Will be going to Georgia for a big Trump Rally in support of our two great Republican Senators, David and Kelly. They are fantastic people who love their Country and love their State. We must work hard and be sure they win. #USA" https://t.co/YjKjOzpYLp https://t.co/sxF42xORin "Thank you to @SenTomCotton for the really nice words on all we are doing, and have done. We will win!" RT @realDonaldTrump : https://t.co/zDkdRmLfvT RT @realDonaldTrump : Pardon investigation is Fake News! "RT @PlaysTrumpCard : Without 1 shred of actual evidence that @realDonaldTrump did anything wrong, the DOJ went ballistic on him. Did a Normandy invasion on Roger Stone. Collected every byte of data from anyone associated.  Now 100's of witnesses detailing vote fraud, &amp; DOJ sees nothing.  get it? https://t.co/7kraGqPsPp" Big voter fraud hearings today in the Great State of Michigan. This election is a far bigger scandal (FRAUD!) than anyone would have thought - not even close. Watch today! https://t.co/zDkdRmLfvT https://t.co/dJniOejwqT https://t.co/n0DrfZnPaX https://t.co/aSWsjTco31 https://t.co/YeK883gDRr The Fake News refuses to report this! https://t.co/OvsdLJQL4u "RT @Andrew_Havranek : The #Wisconsin Supreme Court has ordered @GovEvers to respond to President @realDonaldTrump / @TeamTrump's lawsuit filed this morning, claiming abuse of absentee voting and illegal activity that affected roughly 220,000 ballots. https://t.co/KxrvZw0JX1 https://t.co/NHDdFQHN9u" Pardon investigation is Fake News! Rigged Election. Show signatures and envelopes. Expose the massive voter fraud in Georgia. What is Secretary of State and @BrianKempGA afraid of. They know what well find!!! https://t.co/Km7tRm2s1A Suppression Media! https://t.co/zYlVKeb7oK "RT @MattBraynard : As I said on @LouDobbs, if the issues we raised are not resolved, the nation cannot have confidence that @JoeBiden is the deserved winner.  If he is inaugurated under these circumstances, he cannot be considered ""president"" but instead referred to as the #presidentialoccupant." RT @LouDobbs : Illegal Votes: Former @realDonaldTrump data strategist @mattbraynard discovers thousands of illegally cast mail-in ballots and hands over evidence of electoral fraud to the FBI. #MAGA #AmericaFirst #Dobbs https://t.co/ooL2iW72wP ".....Therefore, if the very dangerous &amp; unfair Section 230 is not completely terminated as part of the National Defense Authorization Act (NDAA), I will be forced to unequivocally VETO the Bill when sent to the very beautiful Resolute desk. Take back America NOW. Thank you!
Section 230, which is a liability shielding gift from the U.S. to Big Tech (the only companies in America that have it - corporate welfare!), is a serious threat to our National Security &amp; Election Integrity. Our Country can never be safe &amp; secure if we allow it to stand....." RT @CBS_Herridge : #Election2020results From a DOJ spokesperson: Some media outlets have incorrectly reported that the Department has concluded its investigation of election fraud and announced an affirmative finding of no fraud in the election. That is not what the Associated Press reported nor .@RealDrGina — Good luck on your new show tonight on @RealAmVoice at 7:00 P.M. Eastern. I know it will be a big hit! https://t.co/3g5fDYX6TR "RT @RedState : Watch: James O'Keefe Calls Into CNN's Morning Conference Call, Tells Startled Jeff Zucker He's Going to Release Two Months of Calls Tonight; Then LOL https://t.co/8lozCVboUn
RT @SaraCarterDC : .@JamesOKeefeIII: We're going to release 'hundreds of hours of CNN' calls 7 pm ET Tonight.  Do any of you want to take a guess at what CNN President Jeff Zucker told his employees on those calls?  #MediaBias  https://t.co/a2st9QUA6f
RT @GreggJarrett : SURPRISE! James OKeefe pops into CNN staff call, tells Jeff Zucker hes been recording calls for months https://t.co/9GGzlWWbeH
RT @marklevinshow : James OKeefe strikes again, CNNs Zucker exposed with recorded phone calls. James will be on my radio show at 7:20 PM eastern. https://t.co/bQevP63q77" https://t.co/0FXHvfJ0c1 https://t.co/HOtVBv9Tfj Jesse Morgan—a truck driver (subcontractor) with USPS in PENNSYLVANIA...https://t.co/EFxXZnQCUS https://t.co/7DWi3pjdIr https://t.co/vV8S7cqDvz "LIVE NOW! Press Conference by Amistad Project: Election Whistleblowers Come Forward https://t.co/Yjh1GsxGvS" Michigan voter fraud hearing going on now! Hope everybody is watching @OANN right now. Other media afraid to show. People are coming forward like never before. Large truck carrying hundreds of thousands of fraudulent (FAKE) ballots to a voting center? TERRIBLE - SAVE AMERICA! https://t.co/QjmZqNeJdt https://t.co/IKBaWI68af https://t.co/PypQRFKuWt https://t.co/hhxUHKxwlE https://t.co/hTRI4vYbY5 https://t.co/x2kNO9LYEO https://t.co/a1kQRp7EzG https://t.co/MLUbZv1OpN https://t.co/uh11qAODPR RT @RSBNetwork : Watch Live: Michigan State Senate Committee on Oversight Holds Hearing on Election Fraud https://t.co/zZSFP4H5IE https://t.co/yNZKyxHky1 https://t.co/7AEjFxJWeH https://t.co/wNKLOhse2v "The president was RIGHT when he said get the kids back in school—Now Dr. Fauci says, 'You know what, I'm looking at the data—the kids should be in school.'"" @kilmeade  https://t.co/2FtrIcqO1B" Do something @BrianKempGA. You allowed your state to be scammed. We must check signatures and count signed envelopes against ballots. Then call off election. It wont be needed. We will all WIN! https://t.co/UiJrlyBGiK We won Michigan by a lot! https://t.co/D6inAewQxP Impossible result! https://t.co/QDaxamGs3p "Fake election results in Nevada, also! https://t.co/l8MDOSlqQ7" RT @Henryhooddavis : THE QUESTION IS??? https://t.co/9gDdGraWAH Disgraceful! https://t.co/t0epa2ItFm RT @TeamTrump : Mayor @RudyGiuliani urges Arizona state legislatures to protect the sacred right to vote https://t.co/vh7QgGMPr6 A judge in Nevada has ordered Clark County officials to allow an inspection of the elections equipment and sealed containers used in the 2020 election by 1:00 P.M. tomorrow. @RichardGrenell @AdamLaxalt @mschlapp "RT @iheartmindy : Twitter just suspended this guys account for testifying why he would never have certified Arizonas results with the mathematically problematic numbers in front of him.  Does the Left think theyre just going to suppress and censor Bidens fake presidency to life? https://t.co/gKozF9TAxl
RT @iheartmindy : Dominion Voting System donated thousands of dollars to an anti-Trump Republican PAC linked to our Sec of State in Nevada.  Explain to me exactly what an election company is doing donating to ANY political side of an election they are contracted to run?  https://t.co/QnUAaRptnJ https://t.co/61B900J7QU
RT @catturd2 : Rudy Giuliani is presenting a ton of evidence.   If you ignore or refuse to look at the mountain of evidence being presented - save your breath barking to us about there being no evidence.   You cant have it both ways.
RT @KamVTV : They never thought they would get caught. They did. Notice how quiet they are? If I was accused of cheating  I would fight like hell to clear my name.   Nope. Their silence says it all." RT @catturd2 : Arizona Witness: Truck Loads of Ballots Kept Coming in For 10 Days After Elections Officials Thought They Were Done Counting Votes (VIDEO) via @gatewaypundit https://t.co/zqGII6Sovx "RT @catturd2 : They never thought Trump and We the People would call bullshit and fight back hard.   They were wrong." Only in America! https://t.co/s0sS1eYXJy Not statistically possible. Rigged Election! https://t.co/Yw8roUTJhy Thank you! A lot of Senators and House Members are very happy that I came along. Think Ill stick around for awhile! https://t.co/stOYWuAJ13 Donald Trump Calls In to Arizona Voter Fraud Hearing: We‘re Fighting Back https://t.co/pzDS6YnwSf via @BreitbartNews. A very inspiring hearing. Such great support from both witnesses to election fraud and political leaders! Arizona hearings on live right now on @OANN. Such total corruption. So sad for our country! ...And there are many such articles. Rigged Election! https://t.co/P8scMauhcI "RT @RedWingGrips : Brian Kemp: ""My state ran the most corrupt election in American history.""  Doug Ducey: ""Hold my beer.""
RT @CarmineSabia : Watching the Arizona hearings and then watching Gov. Ducey sign those papers, why bother voting for Republicans if what you get is Ducey and Kemp?" TRUE! https://t.co/GaldE1fto5 "Why is he rushing to put a Democrat in office, especially when so many horrible things concerning voter fraud are being revealed at the hearing going on right now. @OANN What is going on with @dougducey? Republicans will long remember! https://t.co/XILGaHcyw7" RT @RSBNetwork : Watch Live: Arizona State Legislature Hearing on Election Fraud https://t.co/S5Eut0CWff ".@OANN  WOW, total election corruption in Arizona. Hearing on now! Why isnt @FoxNews covering the Arizona hearings?" Trump legal team in Arizona and on @OANN now. Big stuff. Enjoy! Moderna now applying for Emergency Vaccine Approval.. @US_FDA MUST ACT QUICKLY!!!  Operation Warp Speed has been a great modern day miracle. "RT @NineNewsNancy : @RandPaul wants an explanation on WHY Trump's ""defeat"" happened in FOUR DATA DUMPS between 1:34 am &amp; 6:31 am.  We all know Trump won this election.  If we dont fight for truth here — we will FOREVER get evil by default. #FreeAndFairElections https://t.co/0AbXUkZ7eb
....Also, quickly check the number of envelopes versus the number of ballots. You may just find that there are many more ballots than there are envelopes. So simple, and so easy to do. Georgia Republicans are angry, all Republicans are angry. Get it done!
Why wont Governor @BrianKempGA, the hapless Governor of Georgia, use his emergency powers, which can be easily done, to overrule his obstinate Secretary of State, and do a match of signatures on envelopes. It will be a goldmine of fraud, and we will easily WIN the state....
Im not fighting for me, Im fighting for the 74,000,000 million people (not including the many Trump ballots that were tossed), a record for a sitting President, who voted for me!" NO WAY WE LOST THIS ELECTION! https://t.co/orOXBaR8uE RT @DanScavino : ?? https://t.co/aJetilcmpD "Pennsylvania can lead the way, just like it did many years ago. Very important things happening! https://t.co/uzG29zpBAk" RT @NatalieJHarp : MAKE CALIFORNIA GREAT AGAIN! ???????????? https://t.co/8jzo2PLh0q "RT @realLizUSA : To all Americans, what we choose to do in this life should never be stopped by fear. - @GenFlynn  ????????  https://t.co/cicoz7TlsB" RT @realLizUSA : https://t.co/yadAhKrW3a "Democrats suffered crushing down-ballot loss across America. @nytimes. This is true. All statehouses won, and in Washington we did great. So I led this great charge, and Im the only one that lost? No, it doesnt work that way. This was a massive fraud, a RIGGED ELECTION!" GREAT NEWS! Is Fake News @60Minutes watching this? https://t.co/v9T2MUmGss Get well soon! https://t.co/B0seiO84ld ".@60Minutes never asked us for a comment about their ridiculous, one sided story on election security, which is an international joke. Our 2020 Election, from poorly rated Dominion to a Country FLOODED with unaccounted for Mail-In ballots, was probably our least secure EVER!
We have some big things happening in our various litigations on the Election Hoax. Everybody knows it was Rigged. They know Biden didnt get more votes from the Black community than Obama, &amp; certainly didnt get 80,000,000 votes. Look what happened in Detroit, Philadelphia, plus!" https://t.co/eBx76i3wfD https://t.co/qqm2zlwsXO https://t.co/I5iE77OeXS https://t.co/12jTDVX7ud Will be doing an interview with @MariaBartiromo at 10:00 A.M. on @FoxNews. Enjoy! https://t.co/3U58KQw3I6 "The number of ballots that our Campaign is challenging in the Pennsylvania case is FAR LARGER than the 81,000 vote margin. Its not even close. Fraud and illegality ARE a big part of the case. Documents being completed. We will appeal!
Specific allegations were made, and we have massive proof, in the Pennsylvania case. Some people just dont want to see it. They want nothing to do with saving our Country. Sad!!!
The Wisconsin recount is not about finding mistakes in the count, it is about finding people who have voted illegally, and that case will be brought after the recount is over, on Monday or Tuesday. We have found many illegal votes. Stay tuned!
.@FoxNews daytime is virtually unwatchable, especially during the weekends. Watch @OANN, @newsmax, or almost anything else. You wont have to suffer through endless interviews with Democrats, and even worse!
RT @dougmastriano : It is, as always, truly worth defending. https://t.co/MhoHwuuJZY" Alan Dershowitz: Trump was ‘Absolutely Right‘ to Pardon Michael Flynn https://t.co/nMGOgOM9PP via @BreitbartNews So much credit to all of the brave men and women in state houses who are defending our great Constitution. Thank you! "The 1,126,940 votes were created out of thin air. I won Pennsylvania by a lot, perhaps more than anyone will ever know. The Pennsylvania votes were RIGGED. All other swing states also. The world is watching! https://t.co/zmnk34Ny23" https://t.co/NPQ2vJzb8c Rudy Giuliani will be on Greg Kelly Reports. 7:15 P.M. @newsmax The restaurant business is being absolutely decimated. Congress should step up and help. Time is of the essence! RT @SenMastriano : This was posted on our Department of State dashboard but had since been deleted. https://t.co/bDmvCK0kDB "Biden did poorly in big cities (Politico), except those of Detroit (more votes than people!), Philadelphia, Atlanta and Milwaukee, which he had to win. Not surprisingly, they are all located in the most important swing states, and are long known for being politically corrupt!
RT @LouDobbs : Trump says coronavirus vaccine deliveries will start next week  https://t.co/fjhRqmaQ7N" https://t.co/krPhg9V5oi "Biden can only enter the White House as President if he can prove that his ridiculous 80,000,000 votes were not fraudulently or illegally obtained. When you see what happened in Detroit, Atlanta, Philadelphia &amp; Milwaukee, massive voter fraud, hes got a big unsolvable problem!
RT @yossi_melman : Mohsen Fakhrizadeh has been assassinated in Damavand, east of Tehran according to reports in Iran. He was head of Irans secret military program and wanted for many years by Mossad. His death is a major psychological and professional blow for Iran.
RT @yossi_melman : ???? ?????? ????? ???? ???? ????? ?? ???????? ???? ????? ????? ?????? ??? ???? ??? ????. ?????? ????? ?????? ?????? ??????? ?? ???? ???????? ""??? ????"" ????. ??? ??? ????' ??????? ??????????? ???? ??????, ??? ???? ????? ?????? ?????? ?????? ???? ?- SPND ?????. ???? (??""?) ???????
RT @nytimes : Breaking News: Irans top nuclear scientist was fatally shot in northern Iran, state media reported. He was seen as the force behind its nuclear weapons program. https://t.co/5sG7mqJA0i" RT @DanScavino : ?? https://t.co/XEo6NoM1D1 "Big Tech and the Fake News Media have partnered to Suppress. Freedom of the Press is gone, a thing of the past. Thats why they refuse to report the real facts and figures of the 2020 Election or even, wheres Hunter! https://t.co/8lRglItLJt" So much truth! https://t.co/KGBQDEPEkV All newly rebuilt military! https://t.co/EFwUReJgcD RT @DanScavino : https://t.co/2EkFYjqjQy Yesterdays news conference being broadcast in full now on @Newsmax. Enjoy! "No, the 2020 Election was a total scam, we won by a lot (and will hopefully turn over the fraudulent result), but we must get out and help David and Kelly, two GREAT people. Otherwise we are playing right into the hands of some very sick people. I will be in Georgia on Saturday! https://t.co/1ziqFq9S6O" https://t.co/wYYTUuM5ih RT @OANN : Data group exposes widespread mail-in ballot fraud - https://t.co/GHSjhkq0sF #OANN https://t.co/Tc0VqMDeyA "RT @OANN : Attorney diGenova says fraud, deception in Pa. election is ‘truly staggering - https://t.co/LnSJ69l4s5 #OANN https://t.co/DxRDHyF0ee
RT @NEWSMAX : Newsom, 'Bumbling Biden' and more - who are the Top 5 BIGGEST TURKEYS of the week? ?? - Newsmax TV's Grant Stinchfield @stinchfield1776 https://t.co/VlT7z8drtO https://t.co/Q1pwzjf5ai
RT @NEWSMAX : ""They got caught.""  - President Trump fires off on the perpetrators of 'fraud,' and applauds Rudy Giuliani for his efforts. https://t.co/VlT7z8drtO https://t.co/aY0wnHVPHp
RT @NEWSMAX : Ric Grenell: The case against Michael Flynn was ""completely OVERBLOWN."" https://t.co/v1lfHDa9cn
RT @realDonaldTrump : A must read. Impossible for Biden to have overcome these, and even greater, odds! https://t.co/cmYFY0va6p
RT @realDonaldTrump : Just saw the vote tabulations. There is NO WAY Biden got 80,000,000 votes!!! This was a 100% RIGGED ELECTION.
Wow! Twitter bans highly respected Pennsylvania State Senator Doug Mastriano after he did a great job of leading a hearing on the 2020 Election fraud. They and the Fake News, working together, want to SILENCE THE TRUTH. Cant let that happen. This is what Communist countries do!
BIG NEWS: Pennsylvania Poll Watcher: USB Drives uploaded to machines, gave Biden thousands of votes. Says 47 USB Drives are now missing. EVERY UPLOAD GAVE BIDEN 50,000 VOTES. @OANN" President Trump nominates record number of Federal Judges. @OANN "REPORT: Bidens Thanksgiving Day Address gets just 1000 views online, a record low. Observers say a candidate with 80,000,000 votes would get many more online viewers. Numbers dont lie, or add up! @OANN" RT @TeamTrump : President @realDonaldTrump delivers a #Thanksgiving message via video conference to members of the U.S. military https://t.co/pRfpxpcayS "RT @TeamTrump : President @realDonaldTrump says vaccine distribution will start next week and the week after for frontline workers, seniors https://t.co/dTx8Pi5tlx
For purposes of National Security, Section 230 must be immediately terminated!!!
Twitter is sending out totally false Trends that have absolutely nothing to do with what is really trending in the world. They make it up, and only negative stuff. Same thing will happen to Twitter as is happening to @FoxNews daytime. Also, big Conservative discrimination!
I gave a long news conference today after wishing the military a Happy Thanksgiving, &amp; realized once again that the Fake News Media coordinates so that the real message of such a conference never gets out. Primary point made was that the 2020 Election was RIGGED, and that I WON!
A must read. Impossible for Biden to have overcome these, and even greater, odds! https://t.co/cmYFY0va6p" https://t.co/Yxc9Lom3As A brilliant woman of courage! https://t.co/2hFos1Uwen "RT @DavidJHarrisJr : The media tried to ignore it, here are clips from the hearing.  https://t.co/NtIVK37eAF" So much TRUTH! https://t.co/zdVj5Dnwnb "Will go down much further. Weekend daytime even worse, dead. They still dont get it. Fantastic alternatives! The late/great Roger Ailes is seriously missed, but I still won LEGAL VOTES by a lot!!! https://t.co/rm0ygRnW3S
A total FRAUD. Statehouse Republicans, proud, strong and honest, will never let this travesty stand! https://t.co/N28yIoRsm5
RT @DavidJHarrisJr : Sidney Powell and Lin Wood hit Georgia with 104-page lawsuit. https://t.co/cDsbK1s2MG" No thanks! https://t.co/IYQSotnMG9 HAPPY THANKSGIVING! https://t.co/56e8Qy7O22 "Just saw the vote tabulations. There is NO WAY Biden got 80,000,000 votes!!! This was a 100% RIGGED ELECTION.
RT @LLinWood : Thanksgiving Eve News!  11th Circuit granted my Emergency Motion for Expedited Review of lawsuit challenging validity of GA election procedure.  We The People delivered a historic landslide win for @realDonaldTrump in GA &amp; nationally.  We The People will not allow it be stolen. https://t.co/YVFmaZzuYj" https://t.co/qr4Q8U76ds Have a great life General Flynn! https://t.co/Qj21mnMP0k "RT @realDonaldTrump : The losers &amp; suckers statement on dead military heroes has been proven to be a total fabrication and lie. IT WAS NEVER MADE! The anonymous fabricator, who is a major sleaze, went forward with the lie despite 25 strong witnesses to the contrary. Welcome to the roaring 20s!
RT @LindseyGrahamSC : @realDonaldTrump I hope General Flynn can now move forward with his life.  Well done President Trump!
RT @Cernovich : After todays Pennsylvania hearing, no person of good faith can claim this was a fair and free election." Great people. Tonight! https://t.co/sfLkaRu1Y5 RT @RepAndyBiggsAZ : The U.S. economy has enjoyed incredible momentum since President @realDonaldTrump took office thanks to his commitment to pro-growth policies. Even the sustained COVID hysteria couldnt stop the economy from storming back under the presidents leadership. https://t.co/hIG8VxovgZ Great job Mark! https://t.co/3yc02yFnGV RT @RepAndyBiggsAZ : Quite a few. https://t.co/iVjgAxyG0l "RT @RepDLesko : The Dow Jones average surpassed 30,000 for the first time ever! Thanks to President @realDonaldTrump's pro-growth, pro-America policies, we are well on our way to rebuilding the greatest economy in history! https://t.co/Npc1FSZ3qD
RT @RepDLesko : Virtual learning hurts many students. The results after over a semester of online learning prove that schools NEED to offer in-person options and get kids safely back into the classroom. https://t.co/raJtrInZSH
RT @SenRickScott : This election has shown we need major reforms to our election systems, including Voter ID laws across the nation, to protect against fraud and rebuild the American peoples trust in fair outcomes.    Read more about my VOTER Act here: https://t.co/ySOSfx63WX
RT @GovRonDeSantis : Florida has had six consecutive months of month-over-month job growth. Over the past month alone, Florida has gained more than 61,000 private sector jobs, lowering the unemployment rate to 6.5%.
RT @GovRonDeSantis : As we get more good news regarding therapies and vaccines, Florida is working hard to make sure that we serve our states most vulnerable, in terms of both current protections and upcoming vaccinations. https://t.co/rUOSctLXhA
RT @RepMattGaetz : President Trump should pardon Flynn, the Thanksgiving turkey, and everyone from himself, to his admin, to Joe Exotic if he has to.  The Left has a bloodlust that will only be quenched if they come for those who fought with @realDonaldTrump to deliver for the American people. https://t.co/wdTfu3Xwmp" RT @LeeMZeldin : Republicans will take back the House in 2022. "This Election was RIGGED, but we will WIN! https://t.co/luS6SnFscx
RT @LeeMZeldin : You cant unite our country by demanding Trump supporters just sit down, shut up &amp; suck it up. It doesnt work like that. Actually that approach only divides us further, especially for the many (you know who you are) who spent the last 4 years resisting, impeaching &amp; obstructing.
RT @LeeMZeldin : The MS-13 crackdown continues. The feds must stay on offense and not let up. https://t.co/Kib56R77Qd
RT @replouiegohmert : If we dont stop the fraud and fix the system, 2022, 2024 and beyond wont be free and fair elections. We must preserve the integrity of our elections. #StopTheSteal  cc: @TheJusticeDept  https://t.co/IlUxdY2ALv
RT @MarkMeadows : Congratulations to General Flynn—a well deserved day for an American Patriot.   What the left did to him and his family these last 4 years must never be allowed to happen again in America." Corrupt Election! https://t.co/MxNjfCEtKP Big news! https://t.co/A7t5YMNeYU https://t.co/FJ6UcmXq5G RT @MarkMeadows : BIG news in Nevada: a Judge has allowed NV Republicans to present findings of widespread voter fraud in a Dec. 3rd hearing. Americans will now hear evidence from those who saw firsthand what happened—a critical step for transparency and remedying illegal ballots. Stay tuned. Data group exposes wide spread Mail-In Ballot Fraud. @ChanelRion  @OANN "It is my Great Honor to announce that General Michael T. Flynn has been granted a Full Pardon. Congratulations to @GenFlynn and his wonderful family, I know you will now have a truly fantastic Thanksgiving!" https://t.co/axJSsyVFJw https://t.co/eazLIxTAIz I will be speaking before a very important Pennsylvania State Senate hearing which is in process now. Talking about the massive voter fraud which took place in the 2020 Election! "RT @TeamTrump : WATCH: Crowd gasps after finding out that a mysterious spike of votes in Pennsylvania had 600,000 votes for Biden and only 3,200 for @realDonaldTrump https://t.co/Sa1n3jpyhf" RT @TeamTrump : GOP poll watcher on how he was denied access to watch polls in Philadelphia https://t.co/VOMKfM6vGn RT @TeamTrump : GOP observer Justin Kweder: Hundreds of thousands of Philadelphia mail-in ballots were processed with ZERO civilian oversight https://t.co/Op2UrGKDld "RT @TeamTrump : Mayor @RudyGiuliani: During the course of this election, big tech and the media have only let one side be heard https://t.co/Ho2MZvSyi6" Rudy Giuliani is right now on @OANN! RIGGED ELECTION! "The losers &amp; suckers statement on dead military heroes has been proven to be a total fabrication and lie. IT WAS NEVER MADE! The anonymous fabricator, who is a major sleaze, went forward with the lie despite 25 strong witnesses to the contrary. Welcome to the roaring 20s!" But 2020 is a long way from over! https://t.co/usdkMvGMhK "RT @jsolomonReports : Trump team wins hearings in Arizona, Michigan and Pennsylvania legislatures on election concerns | Just The News https://t.co/WlWH2mkqdh
RT @jsolomonReports : Rep. McClintock says with Congress and the presidency the left would pack the court and more | Just The News https://t.co/IATow0D3eD
