To all of those who have asked, I will not be going to the Inauguration on January 20th.
The 75,000,000 great American Patriots who voted for me, AMERICA FIRST, and MAKE AMERICA GREAT AGAIN, will have a GIANT VOICE long into the future. They will not be disrespected or treated unfairly in any way, shape or form!!!" https://t.co/csX07ZVWGe "I am asking for everyone at the U.S. Capitol to remain peaceful. No violence! Remember, WE are the Party of Law &amp; Order – respect the Law and our great men and women in Blue. Thank you!" Please support our Capitol Police and Law Enforcement. They are truly on the side of our Country. Stay peaceful! https://t.co/izItBeFE6G These scoundrels are only toying with the @sendavidperdue (a great guy) vote. Just didnt want to announce quite yet. Theyve got as many ballots as are necessary. Rigged Election! Even Mexico uses Voter I.D. The States want to redo their votes. They found out they voted on a FRAUD. Legislatures never approved. Let them do it. BE STRONG! "They just happened to find 50,000 ballots late last night. The USA is embarrassed by fools. Our Election Process is worse than that of third world countries!
THE REPUBLICAN PARTY AND, MORE IMPORTANTLY, OUR COUNTRY, NEEDS THE PRESIDENCY MORE THAN EVER BEFORE - THE POWER OF THE VETO. STAY STRONG!
States want to correct their votes, which they now know were based on irregularities and fraud, plus corrupt process never received legislative approval.  All Mike Pence has to do is send them back to the States, AND WE WIN. Do it Mike, this is a time for extreme courage!" Sleepy Eyes Chuck Todd is so happy with the fake voter tabulation process that he cant even get the words out straight. Sad to watch! "If Vice President @Mike_Pence comes through for us, we will win the Presidency. Many States want to decertify the mistake they made in certifying incorrect &amp; even fraudulent numbers in a process  NOT approved by their State Legislatures (which it must be). Mike can send it back!" RT @DanScavino : ??WOW! We hear you from the West Wing—THANK YOU???????? https://t.co/onytmaJUhp RT @christina_bobb : Pennsylvania is going to Trump.  The legislators have spoken. Get smart Republicans. FIGHT! https://t.co/3fs1oPVnAx RT @TomiLahren : I wonder when the water main is gonna burst in Georgia.... RT @TomiLahren : Democrats scrounging up votes from mystical places again.... RT @TomiLahren : The steal is in the making in Georgia. Wait for it. "RT @kayleighmcenany : Why are they stopping the vote count in Democrat Chatham county, Georgia?  This sounds familiar! ??" Just happened to have found another 4000 ballots from Fulton County. Here we go! Looks like they are setting up a big voter dump against the Republican candidates. Waiting to see how many votes they need? BIG NEWS IN PENNSYLVANIA! https://t.co/7JqTWYUgOr "RT @Jim_Jordan : For nine weeks, Democrats have been afraid to have a real debate on election integrity.   Why? https://t.co/n3hcoOi4rS" I will be speaking at the SAVE AMERICA RALLY tomorrow on the Ellipse at 11AM Eastern. Arrive early — doors open at 7AM Eastern. BIG CROWDS! https://t.co/k4blXESc0c "Antifa is a Terrorist Organization, stay out of Washington. Law enforcement is watching you very closely! @DeptofDefense @TheJusticeDept @DHSgov @DHS_Wolf @SecBernhardt @SecretService @FBI
I hope the Democrats, and even more importantly, the weak and ineffective RINO section of the Republican Party, are looking at the thousands of people pouring into D.C. They wont stand for a landslide election victory to be stolen. @senatemajldr @JohnCornyn @SenJohnThune
Washington is being inundated with people who dont want to see an election victory stolen by emboldened Radical Left Democrats. Our Country has had enough, they wont take it anymore! We hear you (and love you) from the Oval Office. MAKE AMERICA GREAT AGAIN!" GEORGIA! Get out today and VOTE for @KLoeffler and @Perduesenate! https://t.co/YKiSx7d7lp "Reports are coming out of the 12th Congressional District of Georgia that Dominion Machines are not working in certain Republican Strongholds for over an hour. Ballots are being left in lock boxes, hopefully they count them. Thank you Congressman @RickAllen!
RT @DavidPerdueGA : Thank you, @realDonaldTrump. Go vote, Georgia! https://t.co/i8nXk2wrCL
RT @KLoeffler : Georgia, we have a job to do TODAY.  We have to STOP socialism.  We have to PROTECT the American Dream.  We have to SAVE our country!  VOTE! #gapol #gasen https://t.co/YRKTmZh5YL
RT @KLoeffler : Its lunchtime. Have you voted yet?   If you havent — GO VOTE and bring 10 people know!   If you have — call your family, friends, and neighbors to make sure they have too! #gapol #gasen" RT @DavidPerdueGA : The Trump family is right — we need YOU to get out and vote today to defend our majority and defend America! #GASen #gapol https://t.co/mxlEumuQOl The Vice President has the power to reject fraudulently chosen electors. See you in D.C. https://t.co/ti4bChnPKz "Georgia, get out and VOTE for two great Senators, @KLoeffler and @sendavidperdue. So important to do so!
Pleased to announce that @KLoeffler &amp; @sendavidperdue have just joined our great #StopTheSteal group of Senators. They will fight the ridiculous Electoral College Certification of Biden. How do you certify numbers that have now proven to be wrong and, in many cases, fraudulent!" https://t.co/tJkmEhSqY5 https://t.co/X0CIj5dFlV https://t.co/zkFfhX0hOQ https://t.co/gWj2obEKm8 https://t.co/9fRvjIgqKE "On my way, see you soon! https://t.co/7QW23k5b9r" https://t.co/3LNZWTO8NY Heading to Georgia now. See you soon! "The Surrender Caucus within the Republican Party will go down in infamy as weak and ineffective guardians of our Nation, who were willing to accept the certification of fraudulent presidential numbers!
We are not acting to thwart the Democratic process, we are acting to protect it. @SenRonJohnson
Weve seen in the last few months, unprecedented amounts of Voter Fraud. @SenTedCruz  True!
How can you certify an election when the numbers being certified are verifiably WRONG. You will see the real numbers tonight during my speech, but especially on JANUARY 6th. @SenTomCotton Republicans have pluses &amp; minuses, but one thing is sure, THEY NEVER FORGET!" RT @realDonaldTrump : I will be there. Historic day! https://t.co/k6LStsWpfy https://t.co/PXNO26lpoZ https://t.co/2rLJfoKmSS https://t.co/tuGfzK3QPE https://t.co/JEzkcjgLSy https://t.co/NmdLNsfDU2 https://t.co/dN2P40kJLW "Sorry, but the number of votes in the Swing States that we are talking about is VERY LARGE and totally OUTCOME DETERMINATIVE! Only the Democrats and some RINOS would dare dispute this - even though they know it is true!" ....@SenTedCruz @HawleyMO @Jim_Jordan @senatemajldr @GOPLeader &amp; THE WORLD! "The Swing States did not even come close to following the dictates of their State Legislatures. These States  election laws were made up by local judges &amp; politicians, not by their Legislatures, &amp; are therefore, before even getting to irregularities &amp; fraud, UNCONSTITUTIONAL!" Trump Speaks to State Legislators on Call About Decertifying Election https://t.co/z6BgCAe3zX via @BreitbartNews https://t.co/FDUVk8cm9S "RT @AmyKremer : We are excited to announce the site of our January 6th event will be The Ellipse in the Presidents Park, just steps from the White House!  Join us January 6th, doors will open at 7am &amp; youll want to get there early!  RSVP @ https://t.co/6q2dltZHtN!  #MarchForTrump #StopTheSteal
RT @LizWillis_ : Arkansas, you were ??! Next stop: Cape Girardeau, Mo.  @america1stwomen Bus Tour Livestream provided by @RSBNetwork.  #JAN6 #StopTheSteal #MarchForTrump https://t.co/Swov4KntHx
RT @AmyKremer : Why are my own #GA Senators ?@KLoeffler &amp; ?@Perduesenate not supporting this effort?  ?@SenatorLoeffler ?@sendavidperdue  #DoNotCertify #StoptheSteal #MillionMagaMarch #JAN6 #GAsen #gagop  https://t.co/ZJ8ZSZsZiN" RT @AmyKremer : Leaders! https://t.co/SyqyieyBSh I will be there. Historic day! https://t.co/k6LStsWpfy RT @AmyKremer : ?? My President https://t.co/Y2SoGLtgcx RT @AmyKremer : They only had 5 people RSVP and Hunter wasnt one of them... https://t.co/wf4ksW7eOf RT @AmyKremer : The #MarchForTrump bus has gone to more states than Joe Biden has supporters! Great! https://t.co/f0nKNPgqWg "RT @AmyKremer : The #MarchForTrump bus rolls into Bowling Green today at 12 noon.  Senator @RandPaul, come join us &amp; pledge to contest the electoral college for states in which we know there was voter fraud.   We welcome you, Senator. #SaveAmerica #DoNotCertify #MillionMagaMarch #StopTheSteaI https://t.co/D5FXRlVMba
RT @SidneyPowell1 : This election was stolen from the voters in a massive fraud that you &amp; others are now complicit in. American elections are supposed to be completely auditable and transparent.  #WeThePeople demand the Truth &amp; the prosecutions of all who committed voter fraud.  @realDonaldTrump https://t.co/Gd4vNmGxHV" RT @SecPompeo : https://t.co/UvigQGjEsU "RT @BurgessOwens : If you only do what's easy, you will seldom do what's right.
RT @CodeMonkeyZ : 42 U.S.C. 1974 Retention and preservation of records and papers by officers of elections; deposit with custodian; penalty for violation  https://t.co/UZXYC2mQzC https://t.co/pJu5zeIpan" RT @CodeMonkeyZ : Hillary canceled her fireworks show a few days before the 2016 General Election. https://t.co/LD9skjYrC3 "RT @CodeMonkeyZ : If you are planning to attend peaceful protests in DC on the 6th, i recommend wearing a body camera.  The more video angles of that day the better." RT @CodeMonkeyZ : More interesting is that he suggests the inauguration date of January 20 can be extended. https://t.co/q10hxO6JBB "RT @EvanAKilgore : There's a difference between not having the evidence and not hearing the evidence.  Pass it on." RT @JenLawrence21 : We have been marching all around the country for you Mr President. Now we will bring it to DC on Jan 6 and PROUDLY stand beside you! Thank you for fighting for us @realDonaldTrump! @america1stwomen @KylieJaneKremer @AmyKremer @DustinStockton @accordingtokeri @SamAdamsTPP https://t.co/S3omIiooe6 "Something how Dr. Fauci is revered by the LameStream Media as such a great professional, having done, they say, such an incredible job, yet he works for me and the Trump Administration, and I am in no way given any credit for my work. Gee, could this just be more Fake News?
Georgia election data, just revealed, shows that over 17,000 votes illegally flipped from Trump to Biden. @OANN  This alone (there are many other irregularities) is enough to easily swing Georgia to Trump. #StopTheSteal  @HawleyMO @SenTedCruz @Jim_Jordan
I spoke to Secretary of State Brad Raffensperger yesterday about Fulton County and voter fraud in Georgia. He was unwilling, or unable, to answer questions such as the ballots under table scam, ballot destruction, out of state voters, dead voters, and more. He has no clue!
Republicans in Georgia must be careful of the political corruption in Fulton County, which is rampant. The Governor, @BrianKempGA, and his puppet Lt. Governor, @GeoffDuncanGA, have done less than nothing. They are a disgrace to the great people of Georgia!
The number of cases and deaths of the China Virus is far exaggerated in the United States because of @CDCgovs ridiculous method of determination compared to other countries, many of whom report, purposely, very inaccurately and low. When in doubt, call it Covid. Fake News!" The vaccines are being delivered to the states by the Federal Government far faster than they can be administered! "RT @EpochTimes : They fear for their safety and the safety of their families in this hyper-political climate.  A #Michigan attorney in the case that led to a #ForensicAudit of #VotingMachines asked the court to keep secret the identities of the forensic investigators. https://t.co/HPxA9tQqO4
RT @axios : SCOOP: A  growing number of Republican senators — led by Ted Cruz — are set to announce today they also will object to certifying state Electoral College votes on Wednesday, congressional sources familiar with their conversations tell Axios. https://t.co/o7AKaao50l" RT @realDonaldTrump : https://t.co/nslWcFwkCj GOP Senators Join Hawley in Objecting to Electoral College Votes https://t.co/f0JHfN4UUb via @BreitbartNews https://t.co/moYUIcRq56 https://t.co/JLq7hHI42o "RT @alaynatreene : NEW: A growing number of Republican senators — led by Ted Cruz — are set to announce today they also will object to certifying state Electoral College votes on Wednesday, several congressional sources familiar with their conversations tell me   https://t.co/T6Gd6vcbUu
RT @SenatorLankford : Today, I am joining a group of Senators to propose an election commission to resolve the electoral issues. You can view my full statement here: https://t.co/zlCLhSN4Mn https://t.co/rrzc74U7pY" https://t.co/nslWcFwkCj RT @realDonaldTrump : https://t.co/t6nWHJjJAN RT @HawleyMO : Glad to see more Senators joining the fight on #JAN6. I hope many more will listen to their constituents and act https://t.co/cqifv6u3gH So true. Thanks Josh! https://t.co/lacUQC6IHh An attempt to steal a landslide win. Cant let it happen! https://t.co/sKn4iTjUy0 "RT @FoxNews : BREAKING: A coalition of GOP senators and senators-elect, led by Sen. Ted Cruz, will object to the Jan. 6 certification of the election results when a joint session of Congress meets next week unless there is an emergency 10-day audit of the results. https://t.co/qHReN242Ua
RT @marklevinshow : Congratulations to Ted Cruz and these Senate colleagues for stepping up against the mob! https://t.co/0xEMT8gzdY
...And after they see the facts, plenty more to come...Our Country will love them for it! #StopTheSteal https://t.co/0IdbiACLIb
Wow, I guess its not good to go against a President who everyone in Georgia knows got you into office! https://t.co/4xUNdOncoB
.@senatemajldr Mitch M, and all! https://t.co/zLIEKzfpFv
RT @gehrig38 : You know that sound when a sheet of glass begins to shatter, but slowly? That first hard CRACK!!! Then it spiders out? Listen.......https://t.co/VMAc9iLtTB" Civil War: Tucker Carlson Hits His Own Network in Epic Post-Election Monologue https://t.co/xUSQQWCa8q "RT @BernardKerik : Listen to @JovanHPulitzer, and then ask yourself where is the @FBI? https://t.co/Y3twbw4bQ5
RT @SecPompeo : We never, ever paid to get our people home. Appeasement invites more hostage-taking. We restored America's credibility. No more phony ""redlines"" or pallets of cash to dictators and bullies. #Realism #AmericansFirst https://t.co/q164zukiSf
....Just a small portion of these votes give US a big and conclusive win in Georgia. Have they illegally destroyed ballots in Fulton County? After many weeks, we dont yet even have a judge to hear this large scale voter fraud case. The only judge seems to be Staceys sister!
Why havent they done signature verification in Fulton County, Georgia. Why havent they deducted all of the dead people who voted, illegals who voted, non Georgia residents who voted, and tens of thousands of others who voted illegally, from the final vote tally?" MAKE AMERICA GREAT AGAIN! "Will be in Georgia on Monday night, 9:00 P.M. to RALLY for two GREAT people, @sendavidperdue &amp; @KLoeffler. GET READY TO VOTE ON TUESDAY!!!
TRANSPARENCY in medical pricing will be one of the biggest and most important things done for the American citizen. It was just put into service, January 1, against long odds and bitter opposition. Final lawsuits won last week. Enjoy all the extra money you will have!
For historical purposes remember, I was able to get rid of the INDIVIDUAL MANDATE, the most unpopular and expensive part of ObamaCare. You are no longer forced to pay a fortune for the privilege of NOT getting bad healthcare. This ended ObamaCare as we knew it. Thank you!" https://t.co/t6nWHJjJAN RT @realDonaldTrump : https://t.co/FDUVk8cm9S RT @realDonaldTrump : https://t.co/7YHKqgjAub Some States are very slow to inoculate recipients despite successful and very large scale distribution of vaccines by the Federal Government. They will get it done! ....Please remember who got it done!!! "Because of the Trump Administration, hospitals are now required, effective immediately, to publish their REAL PRICES, which will create competition and drive downs costs MASSIVELY. Won lawsuit last week. Bigger than healthcare, its called PRICE TRANSPARENCY....
Only because Biden got very few votes, just like the Election! https://t.co/sNIAJ1i5hu
RT @DonaldJTrumpJr : Judge blocks voter purge in 2 Georgia counties.   Dont believe these things are rigged?   THE JUDGE IS STACY ABRAMS SISTER!!! WTF.  https://t.co/zVnjkXyjsB" Herschel is speaking the truth! https://t.co/6x9VLsc9qf Thank you Madison! https://t.co/XyaAHO9CwC "RT @DonaldJTrumpJr : Alec Baldwin should play Alec Baldwin when SNL parodies his wife pretending shes Spanish for the last few decades as opposed to the basic white girl from Mass that she actually is.   It would be the first funny thing Saturday Night Live has produced in years.
Republicans should have gotten rid of Section 230 in the Defense Bill, and you wouldnt have had this problem. Never learn!!! https://t.co/7wR84Rhln0" January 6th. See you in D.C. https://t.co/vynZTv9lHb RT @realDonaldTrump : https://t.co/Dcm41ThF5k "....is therefore both illegal and invalid, and that would include the two current Senatorial Elections. In Wisconsin, Voters not asking for applications invalidates the Election. All of this without even discussing the millions of fraudulent votes that were cast or altered!
....changes made to the voting process, rules and regulations, many made hastily before the election, and therefore the whole State Election is not legal or Constitutional. Additionally, the Georgia Consent Decree is Unconstitutional &amp; the State 2020 Presidential Election....
Before even discussing the massive corruption which took place in the 2020 Election, which gives us far more votes than is necessary to win all of the Swing States (only need three), it must be noted that the State Legislatures were not in any way responsible for the massive....
Our Republican Senate just missed the opportunity to get rid of Section 230, which gives unlimited power to Big Tech companies. Pathetic!!! Now they want to give people ravaged by the China Virus $600, rather than the $2000 which they so desperately need. Not fair, or smart!" .@FoxNews Weekend Daytime is not watchable. Switching over to @OANN! A great honor! https://t.co/U4WFBWrnF7 NOW! https://t.co/hjC1WW64O6 "Massive amounts of evidence will be presented on the 6th. We won, BIG! https://t.co/ymncRrNR5t
The BIG Protest Rally in Washington, D.C., will take place at 11.00 A.M. on January 6th. Locational details to follow. StopTheSteal!
I hope to see the great Governor of South Dakota @KristiNoem, run against RINO @SenJohnThune, in the upcoming 2022 Primary. She would do a fantastic job in the U.S. Senate, but if not Kristi, others are already lining up. South Dakota wants strong leadership, NOW!
RT @TeamTrump : ??Georgia??  Contact House Speaker David Ralston &amp; Senate Majority Leader Mike Dugan!  They must:  ?Hear the evidence ?Correct false statements ?Demand a vote on decertification  Ralston: (404) 656-5020 david.ralston@house.ga.gov  Dugan: (404) 463-2478 mike.dugan@senate.ga.gov
RT @KylieJaneKremer : The calvary is coming, Mr. President!  JANUARY 6th | Washington, DC  https://t.co/kyp7WF8o5r   ????????????????????  #MarchForTrump #StopTheSteal https://t.co/A6VkNZPlPx" https://t.co/RBgT5SMWGT HAPPY NEW YEAR! https://t.co/7YHKqgjAub https://t.co/FDUVk8cm9S Sen. Josh Hawley Slams Walmart Tweet Calling Him a ‘Sore Loser‘ https://t.co/wmShnPcrzj via @BreitbartNews America is proud of Josh and the many others who are joining him. The USA cannot have fraudulent elections! "Finished off the year with the highest Stock Market in history. Setting records with your 401ks, just like I said you would. Congratulations to all!" https://t.co/2kYtZF8Mei https://t.co/S6fKpzoXZZ We now have far more votes than needed to flip Georgia in the Presidential race. Massive VOTER FRAUD took place. Thank you to the Georgia Legislature for todays revealing meeting! ".@BrianKempGA, his puppet Lt. Governor @GeoffDuncanGA, and Secretary of State, are disasters for Georgia. Wont let professionals get anywhere near Fulton County for signature verifications, or anything else. They are virtually controlled by @staceyabrams &amp; the Democrats. Fools!" Watching @FoxNews is almost as bad as watching Fake News @CNN. New alternatives are developing! "The United States had more votes than it had people voting, by a lot. This travesty cannot be allowed to stand. It was a Rigged Election, one not even fit for third world countries!
JANUARY SIXTH, SEE YOU IN DC!
Twitter is shadow banning like never before. A disgrace that our weak and ineffective political leadership refuses to do anything about Big Tech. Theyre either afraid or stupid, nobody really knows!
Thank you, a great honor! https://t.co/9GfT5c8hY0
Hearings from Atlanta on the Georgia Election overturn now being broadcast LIVE via @RSBNetwork!  https://t.co/ogBvLbKfqG
RT @TeamTrump : Time for state legislators to take the Election seriously.   President @realDonaldTrump needs you to DEMAND they call a SPECIAL SESSION &amp; hear the evidence.  Contact your state legislators NOW!  GA: (404) 656-1776  WI: (608) 266-2517  MI:  (517) 373-6339  AZ: (602) 542-4331 https://t.co/F6GWIYRhvn
Hearings from Atlanta on the Georgia Election overturn now being broadcast. Check it out. @OANN @newsmax and many more. @BrianKempGA should resign from office. He is an obstructionist who refuses to admit that we won Georgia, BIG! Also won the other Swing States." $2000 ASAP! The Federal Government has distributed the vaccines to the states. Now it is up to the states to administer. Get moving! "...millions more votes than Trump, but cant get anywhere close to him in this poll. No incoming president has ever done as badly in this annual survey. @MarkSteynOnline @TuckerCarlson Thats because he got millions of Fake Votes in the 2020 Election, which was RIGGED!
Barack Obama was toppled from the top spot and President Trump claimed the title of the years Most Admired Man. Trump number one, Obama number two, and Joe Biden a very distant number three. Thats also rather odd given the fact that on November 3rd, Biden allegedly racked up
New Lott study estimates 11,350 absentee votes lost to Trump in Georgia. Another 289,000 ""excess (fraudulent) votes"" across GA, AZ, MI, NV, PA, and WI. Check it out! ??https://t.co/eIBjdmox5R https://t.co/2MlKVbBoLO" ....other acts of fraud and irregularities as well. STAY TUNED! "....that, quite frankly, didnt have much of a chance, like 7, 8 or 9. The Presidential Election was Rigged with hundreds of thousands of ballots mysteriously flowing into Swing States very late at night as everyone thought the election was easily won by me. There were many....
The Wall Street Journals very boring &amp; incoherent Editorial fails to mention my big &amp; easy wins in Texas, Florida, Ohio, Iowa &amp; many other states that the @WSJ &amp; other joke polls said I would lose. Also, they fail to mention the fact that I got many Republican Senators elected..
...The consent decree signed by the Secretary, with the consent of Kemp, is perhaps even more poorly negotiated than the deal that John Kerry made with Iran. Now it turns out that Brad Rs brother works for China, and they definitely dont want Trump. So disgusting! #MAGA
I love the Great State of Georgia, but the people who run it, from the Governor, @BrianKempGA, to the Secretary of State, are a complete disaster and dont have a clue, or worse. Nobody can be this stupid. Just allow us to find the crime, and turn the state Republican...." https://t.co/Dcm41ThF5k "RT @SenMastriano : Electoral irregularities are real and prevalent in Pennsylvania. Sadly, despite evidence, our Governor and State Department Secretary refuse to investigate.  My letter to Acting Deputy Attorney General Richard Donoghue. https://t.co/SeCDmRDUux
RT @SenMastriano : Read my opinion on this years election process in PA here:   https://t.co/3FiNcd5OFc" RT @realDonaldTrump : This Tweet from @realDonaldTrump has been withheld in response to a report from the copyright holder. Learn more. "When are we going to be allowed to do signature verification in Fulton County, Georgia? The process is going VERY slowly. @BrianKempGA Pennsylvania just found 205,000 votes more than they had voters. Therefore, we WIN Pennsylvania!!!
It is up to the States to distribute the vaccines once brought to the designated areas by the Federal Government. We have not only developed the vaccines, including putting up money to move the process along quickly, but gotten them to the states. Biden failed with Swine Flu!
Loeffler, Perdue Support Increasing Relief Payments to $2K https://t.co/xLFHNDOBIR via @BreitbartNews. Republicans must support the $2000 payments and must FIGHT the crooked presidential election. We won big!
RT @washingtonpost : The House votes at Trumps request to boost stimulus checks to $2,000 per person. The bills fate in the Senate is uncertain. https://t.co/MAb8rVPVK9
Unless Republicans have a death wish, and it is also the right thing to do, they must approve the $2000 payments ASAP. $600 IS NOT ENOUGH! Also, get rid of Section 230 - Dont let Big Tech steal our Country, and dont let the Democrats steal the Presidential Election. Get tough! https://t.co/GMotstu7OI" ....and Congressmen/Congresswomen Elected. I do believe they forgot! "....Can you imagine if the Republicans stole a Presidential Election from the Democrats - All hell would break out. Republican leadership only wants the path of least resistance. Our leaders (not me, of course!) are pathetic. They only know how to lose! P.S. I got MANY Senators..
